ID,NAME,PROCESSED_NAME
52207,COMPANYLIMITEDLITHIUMIONLIABILITY,company limited lithium ion liability
46676,VOLGOGRADPROMPROEKTLIABILITYCOMPANYLIMITED,volgograd prom pro ek t liability company limited
12418,GonzaloGermanREYSANCHEZ,gonzalo german rey sanchez
50240,DESIGNMACHINECHEMICALOFBUREAUKBKHMBUILDING,design machine chemical of bureau kb kh m building
9541,LTDSIAMCOMPANYNICE,ltd siam company nice
49924,SHENZHENTECHNOLOGYRIONLTDCO,shenzhen technology rion ltd co
47539,IT1LIMITEDCOMPANYDIGITALSOLUTIONSLIABILITY,it 1 limited company digital solutions liability
18769,HIGHJSCSYSTEMSNPOPRECISION,high jsc systems n po precision
49520,LIABILITYSERVICESAEROSTAGECOMPANYLIMITED,liability services aero stage company limited
41058,LIMITEDLIABILITYCOMPANYRUDNIY,limited liability company rud ni y
12087,ManuelDUQUERAMIREZCarlos,manuel duque ramirez carlos
44878,AUTOMOTIVEMOSCOWMOSKVICHSTOCKJOINTFACTORYCOMPANY,automotive moscow mos k vich stock joint factory company
47856,BUREAUCONSTRUCTIONSYSTEMSOFINTEGRATEDLIMITEDLIABILITYCOMPANY,bureau construction systems of integrated limited liability company
47479,COMPANYMOSCOWLIMITEDARMSCOMPANYLIABILITY,company moscow limited arms company liability
45006,RUSSIANLLCENERGYGROUP,russian llc energy group
46435,AKTSIONERNOEOBSHCHESTVOKOMMERCHESKAYAALKORPROIZVODSTVENNAYAMNOGOPROFILNAYAFIRMAZAKRYTOE,a kts i one rno e ob shche st vo kom mer che s kaya a lk or pro iz vo dst ven naya mno go prof il naya firma zak ry toe
19769,KhalifaGHAWILMohamedAhmed,khalifa gh a wil mohamed ahmed
46720,GOLDSIBERIANTRANSLIMITED,gold siberian trans limited
43130,COMPANYLIABILITYSHIPPINGARCTICNEWLIMITED,company liability shipping arctic new limited
47572,GRUPPAKTSIONERNOENAVISOBSHCHESTVO,gr up pak tsi one rno e navi sobs h chest vo
49317,FARADCOMPANYLIMITEDLIABILITY,farad company limited liability
45993,LIMITEDREKLAMACOMPANYRADIOVOLOGDALIABILITY,limited re k lama company radio vol o gda liability
12416,DeysiMOLANOTORRESYamile,dey s imola no torres ya mile
48261,STARPIONEERBENCONTESTATEREAL,star pioneer ben conte state real
8262,BRANCHNETHERLANDSTHEALHARAMAIN,branch netherlands the al hara main
52099,EXPERTCOMPANYLIMITEDTRADINGSIAM,expert company limited trading siam
52473,MEDIALTDSEERESEARCH,media ltd see research
50321,QUANTUMLIABILITYCOMPANYLIMITED,quantum liability company limited
46915,MuhammadALSAYYIDSarahJamal,muhammad al sayyid sarah jamal
10640,DESAPATRACACV,desa patra c acv
52689,DANISMANLIKSIRKETIGAYRIMENKULATLASNOBLEANONIM,dan is man li ksi rke tiga yr i men kul atlas noble an on im
23365,JoseLEONEMiguelMARTINEZ,jose leone miguel martinez
47429,OTVETSTVENNOSTYUVIKTORIYASOGRANICHENNOIOBSHCHESTVO,otv et st ven nost yu viktor iy a so gran i chen noi ob shche st vo
48048,AdrianJorgeORTEGAGALLEGOS,adrian jorge ortega gallegos
48483,ZAPADCOMPANYINTEGRALSTOCKJOINT,zap ad company integral stock joint
52816,SHIPLIMITEDMARSHALPRIVATEMANAGEMENT,ship limited marshal private management
51180,INTERCOMPANYGROUPPODSHIPNIKLIABILITYLIMITED,inter company group pod ship nik liability limited
28296,REPUTABLELLCTRADINGSOURCE,reputable llc trading source
44884,DOOPODROCJUNATEHNOLOGIJEARKTECELEKTRONIKE,doo pod roc juna teh no log ije ark tec el ek tron ike
49206,HUASHENGCOINDUSTRYSHENZHENLTD,hua sheng co industry shenzhen ltd
49484,YURSKILIMITEDLIABILITYCOMPANY,yu r ski limited liability company
39678,MANAGEMENTLIMITEDSHIPEXPANSE,management limited ship expanse
26746,BVBAVOLTRATRANSCORENERGY,bvb a volt ratra nsc or energy
19389,ELDINEZAHERHamdi,e ldin eza her ham di
15968,GLOBALCOLTDSEALINE,global colt d sea line
46793,TRADINGMANDS,trading m and s
23777,HONGKONGHUAXINLTDSHIPPING,hongkong hua x in ltd shipping
49830,TECHNOLOGICALLIMITEDSYSTEMSZVIGENI,technological limited systems z vi geni
45922,COMPANYLIABILITYALFAKOMPONENTLIMITED,company liability alfa kom pone nt limited
49796,CVSADEPERMISIONARIOSTRAVER,cvs a de perm is iona rio stra ver
48734,PRIVATECOMPANYALVANDSANAYEMOTORSAZI,private company a lv and san aye motors a zi
23479,SYSTEMARMANNAMADPARDAZAN,system arm anna mad par daz an
20905,PERALTAEferJoseHIGUITA,peralta e fer jose hig u it a
42716,AFTEROFOILGROZNYEDUCATIONALSTATEHIGHERMDTECHNICALINSTITUTIONNAMEDSTATEFEDERALMILLIONSHCHIKOVEDUCATIONUNIVERSITYBUDGETARYACADEMICIAN,after of oil gro z ny educational state higher md technical institution named state federal million sh chi kov education university budgetary academician
30547,POLICEMINSKUNITPURPOSESPECIAL,police minsk unit purpose special
19184,RIVIERAPANAMASALA,riviera panama sala
45939,LIABILITY2COMPANYLIMITEDDECISIONSINVESTMENT,liability 2 company limited decisions investment
23048,RadwanAliMuhammadQANANHusayn,radwa n ali muhammad q an an husayn
44787,DISANKASANAYISIRKETIVEICLIMITEDINSAATTICARETLOJISTIKPORT,di sank asana yi sir ket ive ic limited in s a attic are tl oj is tik port
28230,YSERVICIOSDEINDUSTRIASCONSORCIOSAAERONAUTICASVENEZOLANOAEREOS,y ser vici os de indus trias cons or cio s a aeronautica sven e zola no aere os
46006,LIABILITYLIMITEDCOMPANYOMP,liability limited company o mp
49002,HamidOsmanMohamedMOHAMED,hamid osman mohamed mohamed
35024,ASSETLLCVEBRFMANAGEMENT,asset llc ve brf management
47538,LIABILITYCOMPANYLIMITEDGPBIT1,liability company limited gp bit 1
12206,TTPTEHRIKETALIBANPAKISTAN,tt p tehri ke taliban pakistan
26397,DALAIvanHERNANDEZRafael,dalai van hernandez rafael
30423,GuillermoCarlosAGUSTINSAN,guillermo carlos agustin san
40657,MININGNOENTERPRISE2,mining no enterprise 2
11884,ShabibKhalafALDULAYMIAhmad,s habib khal a fal du lay mi ahmad
21072,CVBOUNGALOWSVILLAAZULDESA,cv bou nga lows villa azul desa
47813,COMPANYJOINTUZHURALZOLOTOOFPUBLICSTOCKCOMPANIESGROUP,company joint u zh ural zo lo to of public stock companies group
48484,LIMITEDLIABILITYLASERFORMCOMPANY,limited liability laser form company
27943,EMPRENDIMIENTOSMISIONESINMOBILIARIOSSA,em pre ndi mien to s misiones in mobil i a rios s a
50534,BeatrizRODRIGUEZRODRIGUEZCaryslia,be atri z rodriguez rodriguez cary sli a
9387,CVDESACOMERCIALIZADORAAMIA,cv desa co mercia liza dora a mia
50407,LIMITEDTECHSTROYKOMPLEKSCOMPANYLIABILITY,limited techs troy kom ple ks company liability
28650,COANDIMPORTSUNLTDEXPORTDALIANGOLDEN,co and import sun ltd export dalian golden
33234,AbdAbdSHAMSAlRahmanAlNabi,abd abd shams al rahman al nabi
10650,DECVSASINMEXIMPORTADORA,dec vs as in mex import a dora
25634,DIDARTOSEEHOLDINGCOMPANYIRANIAN,did ar to see holding company iranian
8251,GONZALESZEVALLOSMaritzaLupe,gonzales zev all osmar itza lupe
21091,GRUPOEMPRESARIALFCCVSADE,grupo em pre saria lfc cvs a de
7870,MizbanIbrahimALAZZAWIHikmat,miz ban ibrahim a la zz aw ihi km at
49930,ROYOCOTECHNOLOGYSHENZHENLIMITED,roy o co technology shenzhen limited
49942,COMPANYDRONOPORTLIABILITYLIMITED,company dr ono port liability limited
24545,FINANCEALBILADINVESTMENTANDBANKISLAMICFORPSC,finance albi lad investment and bank islamic for ps c
51427,STOCKAKTIVJOINTCOMPANY,stock a kt iv joint company
45953,COMPANYLIMITEDAEROSCANLIABILITY,company limited aeros can liability
48545,STOCKMANELJOINTCOMPANY,stockman el joint company
51081,LIMITEDLIABILITYCOMPANYEKVIK,limited liability company ek vi k
18321,TRADINGSTATESEAPORTFEODOSIAENTERPRISE,trading state seaport fe odo sia enterprise
47993,GAMATICARETSANAYILIMITEDSIRKETIICDISVEOLIMPIK,g amati carets an a yi limited sir ket ii cd is ve olimpik
11487,GUADALESTGRUPOSACVDE,gua dale st grupo s acv de
46815,CatrionaBEUNKimberleyLucinda,cat rion a be un kimberley lucinda
7879,IbrahimHassanALTIKRITIWatban,ibrahim hassan al tikriti wat ban
50246,COMPANYSTRATIMJOINTSTOCK,company stra tim joint stock
50304,WHITEFZCOFOXSHIPMANAGEMENT,white f z co fox ship management
44603,MahamudALIYANIHASSANAhmed,maha mud ali yan i hassan ahmed
47516,BYSTROBANKCOMPANYPUBLICSTOCKJOINT,by s tro bank company public stock joint
26413,DRUGLAUNDERINGGOLDPHARMATRAFFICKINGORGANIZATIONMONEY,drug laundering gold p harm a trafficking organization money
4710,GENERALFORCOMMANDOFPALESTINEPOPULARLIBERATIONTHEFRONT,general for command of palestine popular liberation the front
11552,EnriqueORDONEZJorgeRINCON,enrique or done z jorge rinc on
23896,CONTROLSECURITYCAGROUPPLM,control security ca group plm
34990,RADARRADARMANAGINGKBHOLDINGOJSCCOMPANYSYSTEM,radar radar managing kb holding o jsc company system
49363,LIMITEDCOKONGTAVITHONG,limited co kong tavi thong
46750,GEOLOGICALCOMPANYSTOCKCHUKOTKAJOINTCOMPANYMINING,geological company stock chu kotka joint company mining
28174,BLUEDIAMONDSALOFFSHORESTAR,blue diamonds al offshore star
25464,COTWELFTHGMBHKGOCEAN,co twelfth gmbh kg ocean
10391,GUARDISLAMICCORPSREVOLUTIONARY,guard islamic corps revolutionary
48613,BIMLOGICLIMITEDCOMPANYLIABILITY,bim logic limited company liability
11554,UPEGUIAntonioFranciscoFLOREZ,up e gui antonio francisco flore z
47780,COMPANYRIMERALIABILITYLIMITED,company rim era liability limited
47698,LTDANDHESENIMPORTEXPORTGUANGZHOUCO,ltd and he sen import export guangzhou co
48654,TECHNOLOGIESJOINTCOMPANYSTOCKK,technologies joint company stock k
49944,GRANOBYEDINENIENAUCHNOPROIZVODSTVENNOE,gra no by ed in eni en auch no pro iz vo dst ven no e
45380,GUANLANGLTDHEBEICOBIOTECHNOLOGY,guan lang ltd hebei co biotechnology
26606,GROUPLAFLORIDALLCINVESTMENTS,group la florida llc investments
17237,ROOYANTECHPARSJAHAN,roo yan tech pars jahan
52136,NEFTOSOOGAZPROMAZIYA,ne f to soo gazprom a ziya
41178,CVPRODUZIONIDEDEPECASRL,cvp rod uzi onide de pec as rl
47287,MACIASVILLAMARJoseAdolfo,mac i as villa mar jose adolfo
45026,DESIGNCOMPANYJOINTSTOCKNOVATORBUREAUEXPERIMENTAL,design company joint stock nov at or bureau experimental
50741,NAUCHNOKAISANTPROIZVODSTVENNOEOBYEDINENIELIABILITYLIMITEDCOMPANY,n auch no kai sant pro iz vo dst ven no eo bye dine nie liability limited company
48800,TEKNIKLIMITEDNASIRKETIHAVACILIKVETICARET,tek nik limited nasir ket iha vac ili k vet i caret
33283,BELARUSOFDEPARTMENTINVESTIGATIONSOFTHEOFFINANCIALTHECOMMITTEESTATEREPUBLICOFCONTROL,belarus of department investigations of the of financial the committee state republic of control
25658,ANDPRODUCTIONINDUSTRYRAWEXPLORATIONMATERIALSCOMPANYNUCLEAR,and production industry raw exploration materials company nuclear
51467,STOCKCOMPANYJOINTBANKSINARAPUBLIC,stock company joint banks inara public
51962,COMPANYLIABILITYLIMITEDPETROENGINEERING,company liability limited petro engineering
12696,BANKOFLANDEAST,bank of land east
47543,SERVICEPLATFORMCOMPANYLIMITEDLIABILITY,service platform company limited liability
43070,LEADINGGRANITANDPRODUCTIONENTERPRISETECHNICAL,leading granit and production enterprise technical
48844,LIMITEDCOMPANYLIABILITYPROIZVODSTVENNOAPRIORIKOMPANIYATORGOVAYA,limited company liability pro iz vo dst ven no a priori kom pani yat or go vaya
44984,KOMPANIYALIMITEDPUTORANSKAYALIABILITYGORNAYACOMPANY,kom pani ya limited put or an s kaya liability gor naya company
46682,LIABILITYLIMITEDPROMTEKHPOSTAVKACOMPANY,liability limited prom tek h post a vka company
48518,PRIBOROVAKTSIONERNOEPOLUPROVODNIKOVYKHZAVODOBSHCHESTVOBOLKHOVSKII,pri boro vak tsi one rno epo lu provo d niko vy khz a vo dob shche st vo bol kh ovsk ii
50145,HIDALGOJuanPANDARESCarlos,hidalgo juan panda res carlos
52010,COZUOFUSHANGHAILTDXUANWUSEAFREIGHT,co zu of u shanghai ltd xuan wu sea freight
11485,PANAMADEGRUPOFALCONSA,panama de grupo falcons a
15000,MEZATRAFFICKINGDRUGFLORESORGANIZATION,meza trafficking drug flores organization
12188,CIRCUITODEELECTRONICOCVSA,circuito de electronic o cvs a
45010,KOMPANIYAENERGETICHESKAYACOMPANYLIMITEDLIABILITYSEVERNAYA,kom pani ya energetic he s kaya company limited liability severn aya
52494,STOCKPLANTCOMPANYTENTHBEARINGJOINT,stock plant company tenth bearing joint
34179,GONGCHUANGCOTECHNOLOGYLTDWUHANYUANCHENG,gong chuang co technology ltd wuhan yuan cheng
51541,RNLIMITEDLIABILITYCOMPANYSERVICE,rn limited liability company service
51593,OILLIMITEDGARANTCOMPANYSERVICELIABILITY,oil limit edgar ant company service liability
7651,OFTHEREPUBLICILIRIDAARMYOF,of the republic ili rida army of
6823,PATINOJulioVictorFOMEQUE,pati no julio victor fo me que
13008,FORTIADETURISTICOSSACVDESARROLLOS,for tia de turistic oss acv de sar rollo s
19234,DeliaLIRASOTELOAlma,delia liras ot elo alma
32891,MahmoodALRashidAmurHABSI,mahmood al rashid amur habs i
18822,SPRAGRICOLADETAVORL,spr agricola det av orl
34439,SALAMALTRAVELFORTOURISMDAR,salam al travel for tourism dar
11810,DUARTECARDENASConstanzaNorma,duarte cardenas con stanza norma
10692,MohammadAhmedBAHAZIQMahmoud,mohammad ahmed b ahaz iq mahmoud
45081,EbrahimAhmedALSHOFAAliAbdulnabiM,e brahim ah medals h of a ali abdul nabi m
21573,CONSTRUCTORASADECVVANIA,constructor as a dec v vania
47890,COMPANYLIABILITYLEDAMENCOMPANYLIMTEDINTERNATIONAL,company liability led a men company lim ted international
32179,SONSEXCHANGECOSWAIDFORAND,sons exchange cos w aid for and
50017,THERUSSIANINSTITUTIONINSTITUTETHE27STATEOFOFRESEARCHMINISTRYGOVERNMENTALOFCENTRALDEFENSEFEDERALFEDERATION,the russian institution institute the 27 state of of research ministry governmental of central defense federal federation
49421,LIABILITYELGALIMITED2MININGCOMPANY,liability el ga limited 2 mining company
28121,VELCOMDOOBEOGRADTRADE,vel com doo beograd trade
52247,OBSHCHESTVODOMINIKSOGRANICHENNOIOTVETSTVENNOSTYU,ob shche st vo dominik so gran i chen noi otv et st ven nost yu
44599,SERVICESANDFIDELISLOGISTICSUPPLY,services and fidelis logistic supply
50364,SIRKETIELEKTRONIKKAYRALIMITED,sir ke tie lek tron ikk ayr a limited
50317,LIMITEDLIABILITYMINTCOMPANY,limited liability mint company
46714,PROMTECHNOCERTNONPROFITAUTONOMOUSANDORGANIZATIONTESTINGCERTIFICATIONCENTER,prom techno cert nonprofit autonomous and organization testing certification center
30217,INSTITUTERASANEHGOSTARBAYAN,institute rasa neh go star bayan
37804,RESEARCHSTOCKANDMATERIALSCOMPANYINSTITUTESCIENTIFICELECTRONICJOINTOFENGINEERING,research stock and materials company institute scientific electronic joint of engineering
42184,LIABILITYNOVELCOCOMPANYLIMITED,liability novel co company limited
37049,MGFLOTCOMPANYLIMITEDLIABILITY,m gf lot company limited liability
10626,SANCHEZBlancaAGUIRREArmida,sanchez blanca aguirre arm ida
24668,HOLDINGSTRANSINTERNATIONALBVAFRICAN,holdings trans international b v african
28295,STEELCOIRONIRANIANGHADIR,steel coiron iranian g had ir
7308,HURTADOROMEROJairoJose,hurtado romero jair o jose
36421,RUTARGETLIMITEDLIABILITYCOMPANY,ru target limited liability company
15785,LOERAVILLEGASJuanCarlos,lo era villegas juan carlos
46686,INSTITUTENONPROFITANDAUTONOMOUSOFORGANIZATIONMARINEROBOTICSINSTRUMENTATION,institute nonprofit and autonomous of organization marine robotics instrumentation
51985,LIABILITYLIMITEDRIGINTELCOMPANY,liability limited rig intel company
26083,MALHAWSAWIAbdulazizMohammed,mal haw sawi abdulaziz mohammed
43238,ALTERNATIVALIABILITYCOMPANYLIMITED,alter nat iv a liability company limited
10005,CANOCAGUDELOSEN,can oc agudelo sen
8212,STATECOMPANYALHUDAFORRELIGIOUSTOURISM,state company al huda for religious tourism
39165,JOINTCOMPANYELEMENTSTOCK,joint company element stock
42317,SERVICESLOGISTICSANDBUSHRABACHIRSHIPPINGLLC,services logistics and bush ra bach ir shipping llc
50015,COMPANYLIMITEDNPKLIABILITYTESART,company limited np k liability tes art
11913,NATIONALBANKGAZAOFISLAMIC,national bank gaza of islamic
42328,COHKLIMITEDVOHOMTECHNOLOGY,co hk limited vo hom technology
39819,AEONIANCOKONGLIMITEDCOMPLEXHONG,aeon ian co kong limited complex hong
18087,AGCARLONSACVDE,ag carl on s acv de
51139,ARSENALCOMPANY63STOCKJOINT,arsenal company 63 stock joint
39148,OFPHYSICSOFTHEANDTECHNOLOGYFEDERATIONASCIENCERUSSIANACADEMYOFINSTITUTEINSTITUTIONVALIEVASTATESCIENCESKNAMEDFEDERALFINANCEDAFTER,of physics of the and technology federation a science russian academy of institute institution vali eva state sciences k named federal financed after
47652,SOBSHCHESTVO1AOGRANICHENNOIOTVETSTVENNOSTYU,sobs h chest vo 1 aog rani chen noi otv et st ven nost yu
7854,ALTIKRITIMuzahimHassanSab,al tikriti mu za him hassan sab
39319,AdonayCARIASARCHAGAYulan,a do nay cari as arch a gay ulan
17150,BASIRHAWALAHAJIANDCOMPANYZARJMIL,ba sir haw a la haji and company zar j mil
23712,KOREASHIPPINGCOSAMJONG,korea shipping co sam jong
48658,JOINTRESEARCHANDSTOCKMCOMPLEXCOMPANYPRODUCTIONALPHA,joint research and stock m complex company production alpha
25760,CVDESABOUTIQUEJAFIELA,cv desa boutique j afi ela
17025,CarlosVALLEJOMESAJuan,carlos vallejo mesa juan
12868,AliKARIMAbdulALI,ali karim abdul ali
48836,MarinFrancisPIDOUKOUAbbePasaman,marin francis pido u kou abbe pas a man
48693,COMPANYYARSPETSPOSTAVKALIABILITYLIMITED,company yar s pets post a vka liability limited
51175,LIMITEDSIRKETITICARETDISLOGEXLOJISTIKMASSANAYIVE,limited sir ket it i care td is loge xl oj is tik massa nay ive
45047,LIMITEDCOMPANYSTATUSLIABILITYCOMPLAINS,limited company status liability complains
51766,KRONACOMPANYLIABILITYBANKLIMITED,krona company liability bank limited
47548,BEZOPASNOSTISOTVETSTVENNOSTYUOBSHCHESTVOPRAKTICHESKOISISTEMYOGRANICHENNOI,bezopasnosti so tv et st ven nost yu ob shche stv opr a kt ich esko is is tem yog rani chen noi
15226,KHAMISMohammadDeebImad,khamis mohammad dee bi mad
10654,DESAJALSINCOMERCIALIZADORACV,desa jal s in co mercia liza dora cv
13028,BENGOECHEAJoseAntonioUrruticoechea,be ngo ec he a jose antoni our r utico ec he a
52093,EFSUPRIMIKSOSOO,e fsu prim ik so soo
45059,REDMETKONTSENTRATLIMITEDCOMPANYLIABILITY,red met kon t sent rat limited company liability
11245,CVFARMACIADESAJERLYNE,cv farm a cia desa jer lyne
51271,AlfredNANEZNAZARETCONTRERASFreddy,alfred na nez naz are t contreras freddy
28182,COMPANYREALESTATEALYUMUNSAL,company real estate al yum uns al
26468,CANADALTDSMILETECHNOLOGIES,canada ltd smile technologies
44467,PROPERTIESJAZEERALTDPVT,properties jazeera ltd pv t
19493,INDUSTRYMINISTRYOFATOMICENERGY,industry ministry of atomic energy
45256,PETROCHEMICALLLCTRADINGJEP,petrochemical llc trading j ep
47817,PLANTMETALLURGICALSTOCKJOINTCOMPANYSAMARA,plant metallurgical stock joint company samara
16533,AVIATIONFZESKYCOBLUE,aviation f ze sky co blue
18770,ELECTRONICSSTOCKOPENCOMPANYJOINTRUSSIAN,electronics stock open company joint russian
32120,COMPANYBOVAEOOD,company b ova e ood
48813,LIMITEDLIABILITYTRANSSTROYCOMPANY,limited liability trans s troy company
10012,HYOKSINCORPORATIONKOREATRADING,hyo ks incorporation korea trading
8207,HADDADBenBenAssenSalemFethi,had dad ben ben assen salem fet hi
50300,INDUSTRIALTECHNOLOGIESFRANCEGROUP,industrial technologies france group
37427,EXHIBITIONSARLUNITEDCOMPANYINTERNATIONAL,exhibitions a rl united company international
48622,TRADECOSOURCETIANJININTERNATIONALCREATIVELTD,trade co source tianjin international creative ltd
50158,NORILSKIOTVETSTVENNOSTYUOBESPECHIVAYUSHCHIKOMPLEKSOGRANICHENNOIOBSHCHESTVOS,norilsk i otv et st ven nost yu obe spec hi vayu sh chi kom p lek so gran i chen noi ob shche st vos
15842,MORALESJairoEstuardoORELLANA,morales jai roe stu ar do orellana
52208,LIABILITYCOMPANYLIMITEDAPEKSGRUP,liability company limited a pek sgr up
16623,VALLEArnulfoMiguelVALLE,val learn ulf o miguel valle
45588,PRECISIONANDRESEARCHPLANARHOLDINGSFORENGINEERINGPRODUCTION,precision and research planar holdings for engineering production
9408,DORADOSDEEXPRESSCVAUTOSA,dorados de express cv autos a
47870,COMPANYMEKHANIKAJOINTSTOCK,company me khan ika joint stock
47129,HERZALLAHANDSAMIREXCHANGEANDMONEYFORREMITTANCESBROTHERS,herz allah and samir exchange and money for remittances brothers
26694,MONTSERRATAlbertoJorgeARREAZA,montserrat alberto jorge ar re aza
11531,COSTILLAEduardoJorgeSANCHEZ,costilla eduardo jorge sanchez
40983,PLASTICMATERIALSTRADINGLLCBORDO,plastic materials trading llc bor do
47596,PRESSANDFORGEJOINTCHELYABINSKPLANTPUBLICCOMPANYSTOCK,press and forge joint chelyabinsk plant public company stock
48877,MUROMCOMPANYBUREAUDESIGNSPECIALSTOCKJOINT,muro m company bureau design special stock joint
17122,FlorindoEleuterioFLORESHALA,florin do ele uteri o flores hala
11949,PARRAAngelSOTOMiguel,parr a angel so to miguel
45982,DAFENGCOLLCASIA,da feng coll c asia
11833,PedroCASTILLOGUERREROOliveiro,pedro castillo guerrero olive i ro
36425,LIABILITYCOMPANYBARUSLIMITED,liability company baru s limited
47840,HOMEBUILDERPUBLICPIKSTOCKSPECIALIZEDCOMPANYJOINT,home builder public pi k stock specialized company joint
51216,ETOPLIMITEDCOELECTRONICSHK,e top limited co electronics hk
11909,CAMPEROSRENTALTDAURABA,camp eros rental td aura ba
11701,WASHESTETICACVSADECAR,was he ste tica cvs a de car
12423,CASTILLODarioDanitDORIA,castillo dario dan it doria
13173,AntonioFranciscoCOLORADOCESSA,antonio francisco colorado ces s a
52599,OPTICALGLASSJOINTSTOCKPLANTCOMPANYLYTKARINO,optical glass joint stock plant company ly t kari no
51281,FASTEIRLIABILITYLIMITEDCOMPANYINTERNESHNL,fast eir liability limited company internes hnl
46849,AbdulASANNihatKadir,abdul as an nih atka dir
34120,RuknooddinShaheedBHOREMohammed,ru kno odd in shaheed bh ore mohammed
10365,CVJAMAROCONSTRUCTORESDESA,cv j amaro constructor es desa
49997,JOINTSPECIALFORCOMPANYSTATE31DESIGNSTOCKINSTITUTECONSTRUCTION,joint special for company state 31 design stock institute construction
49969,LIMITEDINCSHOREBRIGHT,limited inc shore bright
8315,ALATRUSHMirzaUmaralWahhabAbd,al at rush mirza umar al wahhab abd
35865,MOLOTAKTSIONERNOEZAVODELEKTROMEKHANICHESKIIOBSHCHESTVOPETROVSKII,mo lot a kts i one rno eza vo de lek t rome kha niches kii ob shche st vo petrov ski i
31675,OFOFOBLASTCOMMITTEEINTERNALEXECUTIVEBRESTDIRECTORATEAFFAIRSTHE,of of oblast committee internal executive brest directorate affairs the
41661,CVMXDEBUSSINESCORPORATIVOSAINSIDER,cv mx de bus sines corpora ti vos a insider
29120,LIMITEDCOMMODITIESJIANGTRADEJIAYISMALLCOMPANYZHE,limited commodities jiang trade jia yi small company zhe
51466,NEZAVISIMYIREGIONALNYIOBSHCHESTVOAKTSIONERNOEAGENTSTVOREGISTRATOR,nez avi sim yi regional nyi ob shche stv oak tsi one rno e agents tv or egis tr at or
10381,SALAZARCAZAREZVictorEmilio,salazar c aza rez victor emilio
40933,LIMITEDDISNAABSIRKETIKIMYATICARET,limited d isn aab sir ke tiki my at i caret
41664,RESGUARDOCVSASERVICIOSINTEGRALESVALORESDERSVIYDE,res guard o cvs as er vici os integral es valore s de rsv iy de
7473,RIYADUSSALIKHINRECONNAISSANCESABOTAGEANDTHEMARTYRSOFCHECHENBATTALION,ri yad uss ali khin reconnaissance sabotage and the martyrs of chechen battalion
4108,MiguelOREJUELARODRIGUEZAngel,miguel ore jue la rodriguez angel
49169,SHIPYARDBELOGORODSKAYALIMITEDLIABILITYCOMPANY,shipyard be logo rods kaya limited liability company
52262,OFARMEDPEOPLESTHE53THEMINISTRYDEPARTMENTFORCESOF,of armed peoples the 53 the ministry department forces of
50430,COMPANYFZELIABILITYGOLIMITEDSERVICES,company f ze liability go limited services
48906,LIMITEDBELLUGASIRKETIVEICTICARETDIS,limited bell uga sir ket ive ict i care td is
37770,LIMITEDLIABILITYALFAINVESTCOMPANY,limited liability alfa invest company
13346,ORDONEZAlirioHermesCASANOVA,or done zal i rio hermes casanova
46471,JOINTCOMPANYSTOCKALEVKURPOPEN,joint company stock a lev kur pope n
47507,PIPECOMPANYPOLYMERPLANTLIMITEDLIABILITY,pipe company polymer plant limited liability
34957,FZEFANIOILTRADING,f zef ani oil trading
42204,TRANSLINEINVESTLIMITEDCOMPANYLIABILITY,trans line invest limited company liability
36517,AKTSIONERNOEINZHINIRINGOVAYAOBSHCHESTVOKORPORATSIYANATSIONALNAYA,a kts i one rno e in zhin i ringo vaya ob shche stv ok or po rats i yan at s ional naya
51275,SIRKETIENDUSTRITICARETICONIHRACATLIMITED,sir ke tien dust rit i caret icon ihr a cat limited
24812,INFANTRYDIVISION33RDARMYTHEOFLIGHTBURMESE,infantry division 33 rd army the of light burmese
35894,COMPANYENGINEERINGJOINTPRODUCTIVESTUPINOENTERPRISESTOCK,company engineering joint productive s tupi no enterprise stock
47853,GOLDGEYSERLIABILITYLIMITEDCOMPANY,gold geyser liability limited company
52227,SNABDZHETLIABILITYCOMPANYLIMITED,s nab dz he t liability company limited
47771,COMPANYLIMITEDSERVISRIMERALIABILITY,company limited se rvis rim era liability
46468,AliAlAbedBARAKARahman,alia la bed baraka rahman
38060,DALNEVOSTOCHNAYALIABILITYAVIAKOMPANIYAKSMCOMPANYLIMITED,dal n evo stoch naya liability a via kom pani yaks m company limited
35890,COMPANYPMREDUCTORJOINTSTOCK,company pm re duct or joint stock
34279,ENTERPRISENEGOCIOSCOMERCIOEEIRELIMOVEISINTERMEDIACAODEDE,enterprise ne go cio s comercio e eir eli move is intermedia cao dede
13358,LuisGerardoCARDONAIBARRA,luis gerardo cardona i barra
48543,MCOMPANYTREALLIMITEDLIABILITY,m company t real limited liability
33878,DOODOLLYBEOGRADNOVIBEOGRADBELL,doo dolly beograd novi beograd bell
34538,BANKVENTUREJOINTVIETNAMRUSSIA,bank venture joint vietnam russia
11418,UNIDOSSELVAAEREOSTRANSPORTESSAAMAZONICA,unidos s elva aere os transport ess a amazon ica
40992,KAMBIZPARTNERSANDNABIZADEHEXCHANGE,kam biz partners and nabi za deh exchange
48948,LIMITEDTRADINGHORIZONSNEW,limited trading horizons new
45778,DISSIRKETILIMITEDSMARTGROUPVETICARETTECHNOLOJISTIK,d is sir ket i limited smart group vet i caret techno lo j is tik
52235,LIABILITYPROIZVODSTVENNOENEVAAPPARATCOMPANYPREDPRIYATIENAUCHNOLIMITED,liability pro iz vo dst ven no en eva appa rat company pre dpr iy a tien auch no limited
25479,COMPANYLINESIRITALSHIPPING,company line sir it al shipping
36020,HAOKUNCOMPANYENERGYGROUPLIMITED,hao kun company energy group limited
18108,SANCHEZRominaSilviaCARLON,sanchez rom in a silvia carl on
45952,MFGGLOBLELIMITEDBESTOP,m fg glob le limited be stop
51785,STOCKCOMMERCIALFDCOMPANYJOINTURALBANK,stock commercial fd company joint ural bank
11607,MINESINDUSTRIESDEVELOPMENTANDORGANIZATIONANDMININGRENOVATIONIRANIAN,mines industries development and organization and mining renovation iranian
26861,RESOURCESSOUTHCOMPANYWEALTH,resources south company wealth
46627,LIMITEDIMAXCHIPTECHNOLOGYCO,limited imax chip technology co
10657,ALJABURIRakinThaminMishan,al j a buri rak in tham in mi shan
2685,MuhammadTalalRashidNAJI,muhammad talal rashid na ji
39217,LIMITEDINTERNATIONALCOMPANYDYNASTY,limited international company dynasty
40950,ENERGYFZEALBAHRALAAHMAR,energy f zeal bahr a la ahmar
