ID,NAME,PROCESSED_NAME
27591,TRADINGLIMITEDGENERALALCARDINAL,trading limited general al cardinal
46040,ROSKAPSTROYWATERLIABILITYLIMITEDCLEANCOMPANY,ros kap s troy water liability limited clean company
11246,AMERICANDESATUNECVUP,american desa tune cv up
25078,JorgeGOMEZRODRIGUEZJesus,jorge gomez rodriguez jesus
47475,CLOSEDSTOCKJOINTSERVICESSPECIALCOMPANYTRANSPORTATION,closed stock joint services special company transportation
45971,COMPANYLIABILITYLIMITEDPRIMELEX,company liability limited prime lex
49268,RUSMEDTORGOBSHCHESTVOOGRANICHENNOIOTVETSTVENNOSTYUS,rus med tor gob shche stv oo gran i chen noi otv et st ven nos tyus
42942,NIGHTSBEIJINGSHINYCOTECHNOLOGYLTDDEVELOPMENT,nights beijing shiny co technology ltd development
47847,GEOPROMAININGLIABILITYMENKECHELIMITEDVERKHNECOMPANY,geo pro main ing liability menke che limited ver kh ne company
16990,CPCLSINVERSIONESYCIAENCS,c pcl s in versione sy cia enc s
10596,GENERALTRADINGFMFLLC,general trading fm f llc
7858,JalilTahirHabbushALTIKRITI,jalil tahir hab bush al tikriti
35012,LIMITEDCOMPANYNERODRINKS,limited company nero drinks
44038,COMPANYMACHINESTOCKOPENBUILDINGPLANTJOINTARSENAL,company machine stock open building plant joint arsenal
49341,LIMITEDTAKIMLARVESANAYITICARETMINYONKESICIMAKINESIRKETI,limited taki m lar ves an ayiti caret minyo n kes ici makin e sir ket i
48710,TRANSGULFLLCAGENCY,trans gulf llc agency
41277,DEVICESTRADINGHULMELECTRICSAHRAAL,devices trading h ulm electrics a hra al
46522,JOINTCOMPANYINSTITUTEELPASTOCKPILOTLINERESEARCHAND,joint company institute el pa stock pilot line research and
46923,BHDARTASDNWAVE,bh dart as dn wave
52127,ORENBURGLIMITEDLIABILITYCOMPANYGAZPROMNEFT,orenburg limited liability company gazprom ne ft
10622,SANCHEZHectorBELTRANManuel,sanchez hector beltr an manuel
47294,COMPANYLIMITEDLIABILITYEXIMALABUGA,company limited liability e xima la bug a
8192,ALTIKRITISaddamRaghadHussein,al tikriti saddam raghad hussein
49794,SUMINISTROSDECVOCEANOSSACOMBUSTIBLES,sum in is tros dec voce a nossa combustibles
21387,TURABAbuAliMuhammad,tura babu ali muhammad
42097,MANAGEMENTMETALLOINVESTLLCCOMPANY,management metal lo invest llc company
44459,FURAHAPVTCONSTRUCTIONLTD,fur a hap vt construction ltd
47746,ISKRASTOCKMECHANICALPLANTCOMPANYJOINTNOVOSIBIRSK,iskra stock mechanical plant company joint novosibirsk
48027,TSENTRCOMPANYLIMITEDLIABILITYINZHENERNOTEKHNOLOGICHESKIATM,tsen tr company limited liability in zhen er note kh no logic he ski atm
50811,KOMPANIYAOBSHCHESTVOAKTSIONERNOESTALEPROMYSHLENNAYA,kom pani yao b shche stv oak tsi one rno es tale pro my s hlen naya
50243,COMPANYSTOCKJOINTOPENROGACHEVSKYDIAPROEKTORZAVOD,company stock joint open ro gache v sky dia pro ek to rza vo d
49214,AFTERRESEARCHNAMEDPRODUCTIONPOPOVASSOCIATIONANDAS,after research named production pop ov association and as
29118,SHENLIMITEDCOYANGJINGIMPEXPMACHINERYCHENG,shen limited co yang j in gimp exp machinery cheng
52221,LIABILITYSISTEMALIMITEDITKCOMPANY,liability sistema limited it k company
51206,WAREHOUSEFORESSLIMITEDLIABILITYCOMPANY,warehouse for ess limited liability company
45741,SIRKETITASIMACILIKLIMITEDVEDISKUZEYLOGISTICSIHRACATTICARETITHALAT,sir ket it as imac ili k limited ve disk uz ey logistics ihr ac attic are ti thal at
31751,ALEJOSAdolfoCAMBARAGustavo,ale jos adolfo cam bara gustavo
51768,STOCKCREDITCOMPANYJOINTBANKROYAL,stock credit company joint bank royal
30105,COMPANYLIMITEDSUPREMESHIPPING,company limited supreme shipping
9401,SACHIHUAHUADECVFOODS,s a chihuahua dec v foods
10634,JuanCarlosOLIVASOJEDA,juan carlos oliv as ojeda
17228,COMPANYLOGISTICSASIANAVIATIONLIMITED,company logistics asian aviation limited
23604,DRUGRINCONCASTILLOORGANIZATIONTRAFFICKING,drug rinc on castillo organization trafficking
49311,HIGHRUSSIANACADEMYELECTRONICSBRANCHCURRENTSIBERIANINSTITUTEOFSCIENCESOF,high russian academy electronics branch current siberian institute of sciences of
48507,VSRAMECCOMPANYJOINTSTOCK,vs ram ec company joint stock
24786,QassimAliAHMEDAbdullah,qassim ali ahmed abdullah
50723,PALESTINESEILDIBENEFICASOLIDARIETAASSOCIAZIONECONPOPOLO,palestine sei ldi bene fic a solid a rie ta associazione con popolo
48441,CENTERCOMPLEXUNMANNEDLTDSOLUTIONS,center complex unmanned ltd solutions
19174,INMOBILIARIAJCORPM,in mobil i aria j corp m
50003,LEPTONASSOCIATIONRESEARCHPRODUCTIONAND,lepton association research production and
51297,LIMITEDSHREYASCIENCESPRIVATELIFE,limited sh rey a sciences private life
28047,TRYGRANDCOPHEAPLTDCAMBODIAROYAL,try grand cop heap ltd cambodia royal
25958,TAKHTEHHONARBASHAHID,takht eh hon arb a shahid
36676,OOOZOLOTOIKOMPANIYAVEK,ooo zo lot oi kom pani ya vek
46034,ABZLLCRASTBELYI,a bz llc ra st be lyi
47956,COMPANYLIMITEDAURUSLIABILITY,company limited a urus liability
15342,YCATERINGDESACVRENTASSOCIALIKA,y catering des acv rent associa lika
52250,SHIPPINGCOHONGKONGYAQINGLIMITED,shipping co hongkong ya qing limited
16476,DARNAHANSARINALSHARIA,darn a hans arina l sharia
24563,SHORESALESCORTSERVICESOFFCAR,shores al escort services off car
27467,COPETROLEUMCHINALIMITEDCONCORD,co petroleum china limited concord
40571,REMONTNYYAKTSIONERNOYETSENTROBSHCHESTVOSEVEROVOSTOCHNYY,re mont ny yak tsi one rno yet sent rob shche st vos ever ovo stoch n yy
8332,NazarJumahALQASIRAli,n azar ju mahal qa sir ali
23308,RobertoRIVASREYESJose,roberto rivas reyes jose
52582,SOEDINENIISTOCKCOMPANYZAVODJOINTNOVOTROITSKIIHROMOVYH,so ed inen ii stock company za vo d joint novo tro its kii h romo vy h
46515,FEDERALSTATEENTERPRISEKAMENSKYCOMBINE,federal state enterprise kamen sky combine
52176,OBSHCHESTVOOTVETSTVENNOSTYUOGRANICHENNOIMTVS,ob shche st vo otv et st ven nost yu og rani chen noi mtvs
43441,SUITESLIMITEDLILYCOMPANY,suites limited lily company
9485,ALISLAMBULIMuhammadAhmadShawqi,al is lamb uli muhammad ahmad shaw qi
49309,KTSTOCKCOMPANYJOINTSITRONICS,kt stock company joints i tronic s
43262,COMPANYSTOCK53ARSENALJOINT,company stock 53 arsenal joint
45981,LIMITEDLIABILITYCOMPANYHOLDINGINFRASTRACTURE4,limited liability company holding infra s tract ure 4
12186,GRUPOSACVZAVALADEHORTA,grupo s acv zavala de horta
33619,LOPEZRodolfoGUTIERREZFrancisco,lopez rodolfo gutierrez francisco
47642,AKTSIONERNOEOBSHCHESTVOAKONITURAL,a kts i one rno e ob shche stv oak on it ural
49186,RESEARCHJOINTANDPROTEKCOMPANYSTOCKENTERPRISEIMPLEMENTATION,research joint and pro tek company stock enterprise implementation
49768,DEELJICAROBIOCOMBUSTIBLESCVSA,de el ji caro bio combustibles cvs a
50530,PALACIOSMUNOZAntonioMiguel,palacios mun oz antonio miguel
19714,FZEGENERALTRADINGGRANDEUR,f ze general trading grandeur
15699,CVLOSRANCHOAGRICOLAGANADERODEMEZQUITESSA,cv los rancho agricola gana de rode mez quite ssa
46911,BHDSDNTECNOLOGIESADVANCEDSKYLINE,b hds dn tecnol o gies advanced skyline
18715,JOINTSBERBANKCOMPANYSTOCK,joints ber bank company stock
51604,LIABILITYWELLTECHLIMITEDCOMPANY,liability well tech limited company
46809,EUROPEANTRADINGTECHNOLOGYBV,european trading technology b v
50080,COMPANYINFORMATIONYEMENFORTELECOMMUNICATIONTECHNOLOGYASSET,company information yemen for telecommunication technology asset
49411,LIMITEDCOMPANYLIABILITYMEGASTEK,limited company liability megas tek
50740,BYUROINZHINIRINGOOOSPEKTRKONSTRUKTORSKOE,by uro in zhin i ring ooo s pek tr kon str uk tors ko e
49395,JOINTALEKSINSKIIZAVODCOMPANYSTOCKOPYTNYIMEHANICHESKII,joint a lek sins kii za vo d company stock op y t nyi meh a niches kii
9548,COMPANYKDPMAESAILTD,company k dp mae sail td
49819,CVJJESADECONSTRUCTORASA,cv j jes a de constructor as a
7173,IgnacioMEDINAMORENOLuis,ignacio medina moreno luis
43272,LINKSASIAPACIFICLIMITED,links asia pacific limited
52061,BLANCOOSTENOrlandoOrozman,blanco osten orlando or oz man
41113,HOLDINGSYSTEMSCOMPUTERLIMITEDINTELLIGENTLIABILITYCOMPANY,holding systems computer limited intelligent liability company
48248,GHOJEHBIKLORostamSHAHMARI,gh oj eh bi kl oro stam shah mari
49837,LLCENERGYCOFORNACISTRADING,llc energy co for nac is trading
49215,EQUIPMENTMARINEJSCENGINEERINGCORPORATION,equipment marine jsc engineering corporation
12215,OFACADEMYSECONDNATURALSCIENCES,of academy second natural sciences
34498,INSURANCECOMPANYCOMPANYSTOCKROSGOSSTRAKHPUBLICJOINT,insurance company company stock ros goss trak h public joint
10899,ArturoMarcosBELTRANLEYVA,arturo marcos beltr an ley va
44086,LIABILITYSTERLITAMAKCATALYSTCOMPANYLIMITEDPLANT,liability st erlita mak catalyst company limited plant
49382,COMPANYMAYAKKIROVPUBLICPLANTJOINTSTOCK,company mayak kirov public plant joint stock
10587,NOORAbdulMUHAMMADMajeed,noor abdul muhammad maj e ed
46020,RESOURCESRUSSIANTITANIUMLIMITED,resources russian titanium limited
18070,CVATUNERASATRITONDENUEVA,cv a tuner as a triton de nueva
51531,COMPANYSTOCKINVESTGEOSERVISJOINT,company stock invest geo se rvis joint
46909,ENGINEERINGARYATADBIRCOMPANYTEYF,engineering arya tad bir company tey f
17807,PADRONNayarithKatherineHARINGHTON,padr on nayarit h katherine haring ht on
32351,SYRIAN216BRANCHMILITARYINTELLIGENCE,syrian 216 branch military intelligence
42733,LIMITEDCOMPANYMASHOILLIABILITY,limited company mash oil liability
37781,METEORCOMPANYSTOCKJOINTPLANT,meteor company stock joint plant
47707,TGUNLEVSHALLCMAKINGCOMPANY,t gun lev shall c making company
50124,RASPADSKAYAOGRANICHENNOIUGOLNAYAKOMPANIYASOBSHCHESTVOOTVETSTVENNOSTYU,ras pads kaya og rani chen no iu gol nayak om pani ya sobs h chest vo otv et st ven nost yu
27251,CENSCERTAINCOMPANIASAAB,c ens certain comp ania saab
44266,COMMERCIALJSCUNISTREAMBANK,commercial jsc uni stream bank
22080,MuhammadNasiralDinAymanSALIM,muhammad nasir aldin ayman salim
7933,HIRBinAbdulZulkifli,h irb in abdul zu lk if li
34764,LIMITEDTEKHNOLOGIITSIFROVYECOMPANYBUDUSHCHEGOLIABILITY,limited tek hno logi its ifr ov ye company budu shche go liability
40209,KONGFANGHONGLIMITEDHOLDINGSTIAN,kong fang hong limited holdings tian
16020,IRANSHARGHCOMPANY,iran sh argh company
15097,COELECTRONICINDUSTRIESCOMPONENTS,co electronic industries components
46645,LIMITEDMETALMASTERCOMPANYLIABILITY,limited metal master company liability
52577,COMPANYLIABILITYLIMITEDCHERMETSERVIS,company liability limited cher mets e rvis
30106,COSHANGHAILTDREACHGROUPHOLDING,co shanghai ltd reach group holding
43098,KRASNOYARSKJOINTPOLYUSCOMPANYSTOCK,krasnoyarsk joint poly us company stock
45376,VEKPROMPROMYSHLENNAYACOMPANYLIMITEDGRUPPALIABILITY,vek prom pro my s hlen naya company limited g rupp a liability
49952,GALAKTIKAOBSHCHESTVOKORPORATSIYAAKTSIONERNOE,gala kt ika ob shche stv ok or po rats i yaa kts i one rno e
49782,KHAVERIMLIABILITYCOMPANYLIMITED,k have rim liability company limited
52387,OBREGONHectorPEREZAndres,obreg on hector perez andres
30618,LIMITEDDONGMEIINVESTMENTCOGROUP,limited dong mei investment co group
51411,CamiloROSEROEstebanBETANCOURT,camilo rose ro esteban betancourt
46514,JOINTSTOCK75ARSENALCOMPANY,joint stock 75 arsenal company
16023,ZARINCOMPANYRAFSANJANCEMENT,zar in company raf sanj an cement
45901,FORZAWAYALIMITADADEVELOPMENTINVESTMENTALGROUPSOCIEDADAND,forza way a limit ada development investment al group sociedad and
49834,LLCFZMARKETINGAWARDSDIGITAL,llc f z marketing awards digital
34993,JUNIORKINAHANVincentChristopher,junior kina han vincent christopher
49226,ANDCORPORATIONJSCSHIPBUILDINGSHIPREPAIRING,and corporation jsc shipbuilding ship repairing
44578,LIMITEDDEFENSEENGINEERINGLIABILITYPARTNERSHIP,limited defense engineering liability partnership
51887,MARSAENERGYTRADINGDMCC,mars a energy trading dmc c
51373,LLPVISIONSHIPMANAGEMENT,ll p vision ship management
29667,OSORIOLUCESAntonioGuillermo,osorio luce s antonio guillermo
49681,SEPAHOMIDEXCHANGECOMPANY,se paho mid exchange company
11000,RIOPRESIDIOCVMINERADESA,rio presidio cv miner a desa
40876,COMPANIESSAPPHIRESTAROFGROUP,companies sapphire star of group
13014,GEOFARMASACVDE,geo farm as acv de
40212,QUANZHOUYIYANGJINLTDTRADEIMPORTCOEXPORTAND,quan zhou yi yang j in ltd trade import co export and
36258,RASPUNDERECUOKAFSOCIETATEALIMITATATRADING,rasp under ecu oka f societ a tea limit at a trading
49399,UNITARYTEHNOLITENTERPRISEPRODUCTIONSCIENCEPRIVATE,unitary teh no lit enterprise production science private
47754,ENGINEERINGABERGINSTITUTENAMEDCENTRALIRADIOAFTERACADEMICIANRESEARCH,engineering a berg institute named central i radio after academician research
40794,EOOD2016MSKONSULT,e ood 2016 ms kon sul t
32452,ORGANIZATIONTRAFFICKINGDRUGLOSHUISTAS,organization trafficking drug los hui st as
49189,SEMIKHATOVPRODUCTIONACADEMICIANOFAFTERASSOCIATIONAUTOMATICSNAMEDANDNASCIENTIFIC,semi khat ov production academician of after association automatics named and na scientific
36410,SBERBANKCOMPANYTECHNOLOGIESSTOCKJOINT,s ber bank company technologies stock joint
32532,DECLUBSAROJOSJUAREZINDIOSCVDE,de clubs a rojos juarez indios cv de
23825,COLTDKINGLYINTERNATIONALWON,colt d kingly international won
35244,COMPANYCOMPANYMANAGEMENTLIABILITYLIMITEDRVC,company company management liability limited rv c
18048,SalihAbdMuhammadAbdallahalLatifBinALKAWARI,s a lih abd muhammad abdallah all at if bin alka war i
49400,COMPANYLIMITEDLIABILITYSTANKOMASH,company limited liability stan kom ash
13007,CVSADECITADELINMOBILIARIOSDESARROLLOS,cvs a de citadel in mobil i a rios de sar rollo s
15864,COMPANIADERL5GANADERASDEPRMANANTIALES,comp ania der l 5 ga nader as de pr man anti ales
41576,GONZALEZJassielVILLEGASIan,gonzalez j as si el villegas ian
19629,GENERALANDSINGWANGCORPORATIONECONOMICSTRADING,general and sing wang corporation economics trading
15007,BARAKZAIAbdulSattarHaji,b arak zai abdul sattar haji
48670,HajjiHamidEBRAHIMIFORUSHANI,hajj ih amide brahim i for u shani
24431,CONTRERASMarlenyJosefinaHERNANDEZ,contreras marle ny josef in a hernandez
50402,EPLEKSLIMITEDCOMPANYLIABILITYGRUPP,ep lek s limited company liability g rupp
41998,COMPANYTRADINGLIMITEDFOREPOSTLIABILITY,company trading limited fore post liability
48586,INTERNATIONALLIMITEDTULUNHOLDING,international limited tulu n holding
41002,STOCKJOINTZAVODVOTKINSKIYCOMPANY,stock joint za vo dvo tk in ski y company
25451,HAFEZARYASHIPPINGCOMPANYDARYA,hafez arya shipping company darya
50172,SROLABLEARNINGMACHINE,s ro lab learning machine
46488,JuanBASTIDASERENASPablo,juan bastida serena s pablo
9583,JainalAntelSALIJR,jain alan tel s ali jr
29020,TOURISTCITYGRANDTOWN,tourist city grand town
7192,JuanOLARRAGURIDIAntonio,juan o larra guri di antonio
30627,CENTRALOFOFTHEREPUBLICELECTIONBELARUSCOMMISSION,central of of the republic election belarus commission
7598,EUSERVICIODEAEREOSANTANDER,e user vici ode aere o santander
48120,OGRANICHENNOYSVEB3OTVETSTVENNOSTYUOBSHCHESTVOTEKHNOLOGII,og rani chen no ys ve b 3 otv et st ven nost yu ob shche st vote kh no log ii
51404,FORESTSPOZLAKEO,forests p oz lake o
52249,SIRKETIMAKINAANONIMENDUSTRIMETALSAHINLER,sir ket i makin a an on i men dust ri metals ah in ler
34960,PERIDOTTRADINGSHIPPINGANDLLC,peridot trading shipping and llc
42314,LLCKISMAYOTRADINGGENERAL,llc k is mayo trading general
46735,LIMITEDASTECLINGINTERNATIONALCOMPANYLIABILITYCOMPANY,limited as te cling international company liability company
44158,SIBERIANSERVICECOMPANYJSC,siberian service company jsc
40544,INFORMATIONSTUDIESCOMPANYANDFORLEBANESESARL,information studies company and for lebanese sar l
48527,LIMITEDCOMPANYSREDNEVOLZHSKYSTANKOZAVODLIABILITY,limited company s red ne vol zhsky stank oz a vo d liability
28548,ORTEGAMURILLOCarlosJuan,ortega murillo carlos juan
40477,LTDTIANYIRESEARCHSPACEINSTITUTESCIENCECOANDTECHNOLOGYCHANGSHA,ltd tian yi research space institute science co and technology changsha
13116,DEEPPJSOFFSHORECOMPANYTECHNOLOGY,deep pj s offshore company technology
19732,GENERALSEVENSEAGOLDENTRADINGLLC,general seven sea golden trading llc
49364,GROUPBASSIREDOOBEOGRAD,group bass ire doo beograd
43836,ZAMUDIOLERMAAngelGuillermo,zam udio lerm a angel guillermo
28289,ANDARFAIRONSTEELCOMPANY,and a rfa iron steel company
27589,INVESTMENTTRADINGLIMITEDLOUCOMPANYAND,investment trading limited lou company and
46658,VOLOGDABEARINGPLANTCOMPANYCLOSEDJOINTSTOCK,vol o gda bearing plant company closed joint stock
52316,SDNTEFCASMARINEBHD,sd nt efc as marine b hd
30123,SONSANDTALIBPTYLTD,sons and talib pty ltd
51718,BANKJOINTFINANCECOMPANYSTOCKAUTO,bank joint finance company stock auto
32743,MEDICINETHEOFMINISTRYFORMILITARYSTATEDEFENSEEXPERIMENTALINSTITUTEOF,medicine the of ministry for military state defense experimental institute of
29625,LTDFUELTRADINGOMAN,ltd fuel trading oman
17238,BASPARKIMIYAMANDEGARCOMPANY,bas park i miya mande gar company
36065,ZVYOZDOCHKASHIPREPAIRINGCOMPANYJOINTCENTERSTOCK,z vy oz doc hk a ship repairing company joint center stock
33014,POLIGONOSASMARTASANTA,poli go nos as marta santa
40931,STOCKCOMPANYINSTITUTERESEARCHBUREVESTNIKJOINTSCIENTIFICCENTRAL,stock company institute research bure vest nik joint scientific central
32176,GENERALTICARETSIRKETIVEGIDASANAYITRADINGANONIMADOON,general ti caret sir ket ive gid asana yi trading an on im a do on
49877,LIMITEDKITSMARTTECHNOLOGY,limited kit smart technology
35936,STOCKCOMPANYMIKRONJOINT,stock company mik ron joint
31311,BUSTAMANTEDinorahYoselinPUERTA,busta man ted in or a hyo sel in puerta
46431,IZHEVSKELECTROMECHANICALCOMPANYKUPOLPLANTSTOCKJOINT,iz he vs k electromechanical company ku pol plant stock joint
40803,CONSULTINGTRILEMMALTDEOOD,consulting tri lemma lt de ood
32533,MENDOZASCACUAINDUSTRIARLNARCISODEDECV,mendoza sca cu a indus tria rl narc is ode dec v
41299,TECHNOLOGYWUHANSHUOKANGCOBIOLOGICALLTD,technology wuhan s huo kang co biological ltd
29023,ZUBAIDILLCQALEIAND,zub aid ill cq a lei and
48199,GROUPLTDUNITOPHONGKONG,group ltd uni top hongkong
49307,COMPANYLIMITEDHOLDINGLIABILITYYUZHPOLYMETAL,company limited holding liability yu zh poly metal
7330,NEDERLANDBENEVOLENCESTICHTINGINTERNATIONAL,nederland benevolence st ich ting international
45041,BALASHIKHINSKIYLITEYNOCOMPANYOPENSTOCKMEKHANICHESKIYZAVODJOINT,bala shi khin ski yl it ey no company open stock me khan iche ski yz a vo d joint
49795,EDJAMAQUINASCVDESA,ed jam aquinas cv desa
46224,DESKAIRUCVSA,desk air u cvs a
26324,ORGANIZATIONDRUGZHENGTRAFFICKING,organization drug zheng trafficking
17118,ISAZANelsonSANCHEZDario,is aza nelson sanchez dario
11773,SAAVEDRAENSCCIAY,saavedra ens cci ay
25489,JOOMohammadAliYAZDAN,joo mohammad al iyaz dan
25943,ARJANELECTRICITYANDGENERATIONMANAGEMENTENERGY,arjan electricity and generation management energy
8394,SACOPANDORASHIPPING,s a co pandora shipping
15664,DECASADISTRIBUIDORASAELCVLUISVIEJO,dec a sadist rib ui do rasa el cv luis viejo
46648,INVENTLIABILITYCOMPANYLIMITED,invent liability company limited
43038,RESEARCHMINERALSCIENTIFICSTOCKOFSIBERIANCOMPANYMATERIALJOINTANDINSTITUTEGEOPHYSICSRAWGEOLOGY,research mineral scientific stock of siberian company material joint and institute geophysics raw geology
10594,AbdullaAhmadMohammadBEHZADAbdulla,abdull a ahmad mohammad be hz ad abdull a
28547,MONTALVANAdolfoIvanACOSTA,montalva n adolfo ivan acosta
52573,ANDTUGANSKSTOCKCOMPANYPROCESSINGILMENITEMININGJOINTENTERPRISE,and tug an sk stock company processing il men it e mining joint enterprise
45976,LIABILITYCOMPANYLIMITEDSTARTAERO,liability company limited start aero
36324,OOOTSARGRADKURORTSPASTESHILOVO,ooo tsar grad kuro rts pastes hilo vo
39666,AVASERVICESPETROLEUMSA,ava services petroleum s a
11237,ArturoLADINOAVILAJaime,arturo ladino avila jaime
28049,LTDPETROLEUMCOPAPA,ltd petroleum co papa
50280,LIMITEDLIABILITYATRANCOMPANY,limited liability at ran company
51127,PRODUCTIONANDUNITEDRESEARCHPERMCORPORATIONENGINESENGINECOMPLEX,production and united research perm corporation engines engine complex
46215,CVTURISTICOSCOMERCIALIZADORAVALLARTASERVICIOSSADEDEDE,cv turistic osco mercia liza dora vallarta ser vici oss a dedede
11548,CeciliaRODRIGUEZVELASQUEZRuth,cecilia rodriguez velasquez ruth
8744,LIMITEDLEASINGPACIFICWORLDTRANS,limited leasing pacific world trans
9331,ALTIKRITISabawiIbrahimHasanAyman,al tikriti saba wi ibrahim has an ayman
40328,SHIRSHOVPPINSTITUTEOFTHEACADEMYOCEANOLOGYOFRUSSIANOFSCIENCES,s hirsh ov pp institute of the academy ocean ology of russian of sciences
26588,URUGUAYBANDESSABANCO,uruguay band ess a banco
10897,MahmudAdilABDMuhammadALKHALIQ,mahmud a dil abd muhammad al khali q
37739,STATECENTERAFTERNAMEDFLIGHTVPTESTINGCHKALOV,state center after named flight vp testing ch ka lov
50781,RRGENGINEERINGPRIVATELIMITEDTECHNOLOGIES,r rg engineering private limited technologies
11626,COMMERCIALPETROCHEMICALUKLIMITEDCOMPANY,commercial petrochemical uk limited company
23004,COMMERCIALLTDKORYOBANK,commercial ltd ko ryo bank
37256,MORGANHUERTAJoseArnoldo,morgan huerta jose arnold o
48771,MAHDUDCAMIYYATIENERGYLAHICMASULIYYATLI,mah dud cami yy at i energy la hi cm as uli yy at li
10359,ZAMBADAMariaNIEBLATeresa,zam bad a mariani eb la teresa
11695,INPENINSULAALQAIDAARABIANTHE,in peninsula alq aida arabian the
40923,LIMITEDJINXINTRADINGNUO,limited jinx in trading nu o
33594,PARVAZNAFARCOMPANYMADOOJE,par vaz na far company ma doo je
11882,CIAALVAREZYAGUILARLTDA,cia alvarez y aguilar ltd a
48549,VLADIMIRCOMPANYSTOCKOFPLANTHOSESMETALJOINT,vladimir company stock of plant hoses metal joint
38316,FEDERALOFPHYSICSANDINSTITUTIONOFSTATEINSTITUTEHIGHERTECHNOLOGYEDUCATIONMOSCOWVOCATIONAL,federal of physics and institution of state institute higher technology education moscow vocational
42296,2013TRADINGTIALTDOOD,2013 trading tia ltd ood
47132,MuhammadFallahKamilHIRZALLAH,muhammad f allah kamil hi rz allah
28243,CVMASTERREPOSTERIASYDESARESTAURANTES,cv master re poster i as y desa restaurant es
30286,CODESLTDINTERNATIONAL,codes ltd international
47540,IT1COMPANYLIMITEDLIABILITYRTK,it 1 company limited liability rt k
40476,JOINTTECHTERRACOMPANYSTOCK,joint tech terra company stock
46680,YUNZEBEIJINGCOLTDTECHNOLOGY,yun ze beijing colt d technology
48961,CAPITALCONSULTANCIESMANAGEMENTANDTAPLLC,capital consultancies management and tap llc
50409,COMPANYENGINEERINGLIMITEDLIABILITYARMOR,company engineering limited liability armor
50179,CYBERLIMITEDLIABILITYSERENITYCOMPANYSECURITY,cyber limited liability serenity company security
44983,OZERNAYALIABILITYCOMPANYKOMPANIYAENERGETICHESKAYALIMITED,oz er naya liability company kom pani ya energetic he s kaya limited
16696,REPUBLICOFSYRIAOFCONGOTHEDEMOCRATICISLAMICANDIRAQSTATE,republic of syria of congo the democratic islamic and iraq state
34681,INVESTTRADEBANKCOMPANYSTOCKJOINT,invest trade bank company stock joint
45956,LIMITEDSOLUTIONSEMERGENCYLIABILITYCOMPANYDIGITAL,limited solutions emergency liability company digital
51832,BANKSTOCKTRUSTCOMPANYPUBLICJOINT,bank stock trust company public joint
16208,LuisCUELLARCASTROEduardo,luis cuellar castro eduardo
42736,GASLIABILITYEQUIPMENTURALMASHANDLIMITEDCOMPANYOILHOLDING,gas liability equipment ural mash and limited company oil holding
28052,MDCOZTHMORDALTDSES,mdc oz th mor da ltd ses
12476,COMPANYANDGASPARSOIL,company and gaspar soil
44146,LIMITEDGAZPROMNEFTPRIVATEOKHRANALIABILITYCOMPANYORGANIZATIONSECURITY,limited gazprom ne ft private ok h rana liability company organization security
7209,alRahmanKhalidAbdALFAWAZHamd,al rahman khalid abd alfa waz ham d
28294,INDUSTRIALGOLGOHARANDMININGCOMPANY,industrial gol gohar and mining company
7151,SADECVELECTRONICOSACCESOS,sade cv electronic os acc eso s
40824,INVESTMENTCAPITALLEADINGLTD,investment capital leading ltd
32332,JesusJARQUINJARQUINJose,jesus jar quin jar quin jose
47549,JOINTCOMPANYSPBBANKSTOCKPUBLIC,joint company s pb bank stock public
26140,ORGANIZATIONPERALTATRAFFICKINGCESARDRUG,organization peralta trafficking cesar drug
46674,STOCKSCIENTIFICCOMPANYANDTECHNICALPHOTONICSCOMPANYJOINTAZIMUT,stock scientific company and technical photo nics company joint a zim ut
12928,CONSPIRACYNUCLEIFIREOF,conspiracy nuclei fire of
50358,LIMITEDCOAGUINFORMATIONTECHNOLOGY,limited coa gu information technology
47912,KRDVZABAYKALYELIMITEDLIABILITYCOMPANY,kr dv za bay ka lye limited liability company
49242,ELEKTROPRIBORAKTSIONERNOEOBSHCHESTVOZAVODVLADIMIRSKIIOTKRYTOE,el ek tro pri bora kts i one rno e ob shche stv oz a vo d vladimir ski io tk ry toe
15854,FOODLTDMANAGEMENTTFMCCORPORATIONTHE,food ltd management t fm c corporation the
21577,DEAGRICOLARUELASSPRRI,de agricola ruel as spr ri
47185,AHMARALAbdullahHamidHussein,ahmar al abdullah hamid hussein
50785,DELAZIYALIABILITYLIMITEDCOMPANY,dela ziya liability limited company
44462,WARRIORSLTDINVESTMENTGOLDENPVT,warriors ltd investment golden pv t
20880,ALMUHAYSINIMuhammadBinSulaymanAbdallah,a lmu hays in i muhammad bin sulayman abdallah
45920,LIMITEDLIABILITYCOMPANYELECTRONICSSPUTNIK,limited liability company electronics sputnik
17018,STOCKRUSSIAJOINTPUBLICOFSBERBANKCOMPANY,stock russia joint public of s ber bank company
37769,LIMITEDPFMKLIABILITYCOMPANY,limited pf mk liability company
31452,AUTONOMOUSSTATEFEDERALINNOVATIVEERAMILITARYINSTITUTIONTECHNOPOLIS,autonomous state federal innovative era military institution techno polis
24664,MOKUSADORMINES,mok usa dor mines
38580,OGRANICHENNOIMARKUSOBSHCHESTVOSOTVETSTVENNOSTYU,og rani chen noi markus ob shche st vos otv et st ven nost yu
7585,LTDAGAVIOTAYMUELLESDRAGADOS,ltd aga vio tay mu elle s drag a dos
47598,NEVSKYZAVODSTOCKJOINTCOMPANY,nevsky zavods to ck joint company
28286,STEELKAVEHCOMPANYSOUTH,steel ka veh company south
12298,CVSABASALTOSDETONALA,cvs a basal to s de tonal a
48746,GROUPCONSULTINGJSCPOSTPROCESSOR,group consulting jsc post processor
46520,COMPANYJOINTRIFSTOCK,company joint rif stock
3750,COBALTINTERNATIONALINCCO,cobalt international inc co
47271,SABAFONOFFSHORESALINTERNATIONAL,saba fon offshore sal international
50082,ALSHAHARICORPORATIONLIMITEDGUANGZHOUUNITED,al shahar i corporation limited guangzhou united
22285,OFFORCESPEOPLESARMEDMINISTRY,of forces peoples armed ministry
45965,LIMITEDCOMPANYDECISIONS2LIABILITYNEW,limited company decisions 2 liability new
25635,TOSEEDONYASHAHRKOHANCOMPANY,to seed on ya shahr koh an company
47537,LIMITEDIT1COMPANYLIABILITY,limited it 1 company liability
6908,AnwaralSayyidTariqAHMAD,anwar al sayyid tariq ahmad
37777,PLASMACOMPANYSTOCKJOINT,plasma company stock joint
