ID,NAME,PROCESSED_NAME
52177,LIMITEDEVOKORPKOMPANIYACOMPANYUPRAVLYAYUSHCHAYALIABILITY,limited evo kor p kom pani ya company up rav lya yu shc haya liability
50777,OFLIMITEDLIABILITYCOMPANYUNMANNEDTECHNOLOGIESMORDOVIA,of limited liability company unmanned technologies mor do via
12314,SEPULVEDATulioFLOREZMarco,sepulveda tulio flore z marco
45552,LAKTASIAGROVOCEDOO,la kt asia gro voce doo
26220,GROUPCOMMERCIALINCWINDHAM,group commercial inc windham
48742,ITHALATLIMITEDIHRACATTICARETALPHASIRKETIIMPEXDISVE,it hal at limited ihr ac attic are t alpha sir ket i imp exd is ve
52629,LIABILITYPREDPRIYATIEPROIZVODSTVENNOENAUCHNOLIMITEDCOMPANYTECHNOPROEKT,liability pre dpr iy a tie pro iz vo dst ven no en auch no limited company techno pro ek t
52549,LIABILITYLIMITEDSALDAKERAMAKSVERKHNYAYACOMPANY,liability limited salda ker a maks ver kh nyaya company
46270,ZAVODIMOBSHCHESTVOAKTSIONERNOENMIGNATYEVAAKOMAKKUMULYATORNYI,za v odi mob shche stv oak tsi one rno en m ignatyev a a ko mak kum ul yat or nyi
25461,KGOCEANCOGMBHELEVENTH,kg ocean co gmbh eleventh
37689,OPTICALSTOCKPRODUCTIONAFTERESYALAMOVJOINTCOMPANYURALMECHANICALPLANTANDASSOCIATIONNAMED,optical stock production after es y alamo v joint company ural mechanical plant and association named
50052,ZAVODAKTSIONERNOEREKONDOBSHCHESTVO,za voda kts i one rno ere kondo b shche st vo
17386,ALYahyaHAKIMAbdullah,al yahya hakim abdullah
25687,LTDPTEWEESTIONG,ltd pte wees tiong
49752,METALCOYIDATONGMATERIALSLTDTIANJIN,metal coy ida tong materials ltd tianjin
47618,LIMITEDMAKROOPTIKARESEARCHPRODUCTIONLIABILITYCOMPANYCOMPANYAND,limited mak roo pti ka research production liability company company and
48692,KOMMERCHESKAYAPROIZVODSTVENNOVIVAKOMPANIYA,kom mer che s kaya pro iz vo dst ven no viva kom pani ya
25935,ENERGYGILANGHADIRCASPIAN,energy gilan g had ir caspian
50159,OGRANICHENNOIPECHENGSKOESOTVETSTVENNOSTYUSTROITELNOEOBEDINENIEOBSHCHESTVO,og rani chen noi pe cheng sko eso tv et st ven nos tyus troi tel no eo be dine nie ob shche st vo
15691,ACUATICOCASCABELESSALOSPARQUECVDE,a cu a tico casca be less a los parque cv de
47899,LIMITEDLIABILITYEDUCATIONALRESIDENCEURALCOMPANY,limited liability educational residence ural company
21004,ALIAlHasanABKARALI,alia lhasa nab kara li
12580,GENERALLLCTRADINGGREENLEAF,general llc trading greenleaf
51298,LTDCOLIMBACHAIRCRAFTENGINEXIAMEN,ltd co limbach aircraft engine xiamen
44989,COMPANYLLCARCTICUNITED,company llc arctic united
24784,YusopKarimFAIZMohammed,yus op karim faiz mohammed
46777,STOCKCARTRIDGEBARNAULCOMPANYPLANTJOINT,stock cartridge barnaul company plant joint
18095,SAFIRMADELAMIRANDACV,s a firm adela miranda cv
52033,LIMITEDRUSGAZBURENIELIABILITYCOMPANY,limited rus gaz buren ie liability company
23653,INVESTMENTCOINTERNATIONALLIMITEDKINGSROMANS,investment co international limited kings romans
41116,SOFTLIABILITYLIMITEDMFICOMPANY,soft liability limited mfi company
39671,SHIPPINGCORPTIDERISING,shipping corp tide rising
31146,DESPRRLALEGRECOSTAAGRICOLA,de spr rl alegre costa agricola
44093,NEFTEGAZAVTOMATIKAJOINTCOMPANYSTOCK,ne ft e gaz avtomat ika joint company stock
26201,GROUPCORPINVESTMENTSRIM,group corp investments rim
47833,LIMITEDHYPERSPACECOMPANYLIABILITY,limited hyperspace company liability
32355,SYRIANGENERALBRANCHALKHATIBINTELLIGENCE251,syrian general branch al khatib intelligence 251
40864,ZAVODKOMPOZITSIONNYKHULGERODNYKHMATERIALOVI,za vo d kom pozi tsi on ny k hul gero d ny kh material ovi
32729,ASTRALIABILITYLIMITEDDANACOMPANYFOREIGN,astra liability limited dana company foreign
34675,PUBLICSTOCKCOMPANYTRANSKAPITALBANKJOINT,public stock company trans kapital bank joint
11417,REPARACIONESAERODINOSTALLERYDEPARTESAEREOSSERVICIOSDESUSSA,rep a racion es aero dinos taller y depart es aere os ser vici os des uss a
37521,OBYEDINENIYELIABILITYLIMITEDRADIOVOLNACOMPANYNAUCHNOPROIZVODSTVENNOYE,o by ed in eni ye liability limited radio vol na company n auch no pro iz vo dst ven noye
6865,MALHERBELEONDEOscar,mal her be leon de oscar
52182,BEARLIMITEDCOMPANYBRIDZHLIABILITY,bear limited company b rid zh liability
51092,KDGLIMITEDENGINEERINGPRIVATE,k d g limited engineering private
25970,DEVELOPMENTANDINTERNATIONALGHADIRTRADING,development and international g had ir trading
27468,COMPANYLTDHOLDINGKUNLUN,company ltd holding kunlun
7876,ALYASSINHusamAminMuhammad,al yassin husam amin muhammad
45908,FINANCIALTADAWULSAOCSERVICES,financial tada wu ls aoc services
23890,PMA243CAINVERSIONES,pm a 243 cain version es
36019,CHINAENERGYHAOKUNLIMITED,china energy hao k unlimited
47634,MIKROSISTEMANAUCHNOPROIZVODSTVENNOEPREDPRIYATIE,mik rosi stem an auch no pro iz vo dst ven no ep red pri ya tie
18736,COMPANYVTBDEPOSITORYCLOSEDSPECIALIZEDJOINTSTOCK,company vt b depository closed specialized joint stock
49269,OBSHCHESTVOSOGRANICHENNOIMEDSTANDARTOTVETSTVENNOSTYU,ob shche stv oso gran i chen noi med stand art otv et st ven nost yu
11295,KANKASETSANGSIRILIMITEDCOMPANY,kanka set sang siri limited company
44161,OGRANICHENNOJSOTVETSTVENNOSTYUAKTIVNIPIGAZOBSHESTVO,og rani chen no j so tv et st ven nost yu a kt ivn i pig a zob she st vo
51150,ISTOCKCREDSTVIREMONTAVOORYGENIYBIOLOGICHESKOIHIMICHESKOICOMPANY136PROIZVODSTVARADIACIONNOIJOINTOPENBAZAIZACHITUCENTRALNAY,i stock c red st vire mont a voor y geni y bio logic he s koi him iche s koi company 136 pro iz vo dst vara dia ci on noi joint open baz a i zach it u central nay
52015,PORTSUKHODOLLIABILITYMORSKOILIMITEDCOMPANY,ports uk ho dol liability mors koi limited company
52548,COMPANYJOINTURALSKIYMETALLURGICHESKIYKAMENSKSTOCKZAVODPUBLIC,company joint ural ski y metal lu rg iche ski y kamen sk stock za vo d public
48862,VOLGOGRADLIABILITYCOMPANYCOMPANYMACHINELIMITEDBUILDING,volgograd liability company company machine limited building
40795,CRIMINALSALASORGANIZATIONHERNANDEZTRANSNATIONAL,criminals alas organization hernandez transnational
24680,AINMOBILIARIAROFIS,a in mobil iar iar of is
15697,GENERALFZESYNERGYTRADING,general f ze synergy trading
52257,OGRANICHENNOIOBSHCHESTVOSEBOTVETSTVENNOSTYUS,og rani chen noi ob shche st vos e bot vets tv en nos tyus
47496,ALLRUSCOMPANYLIMITEDLIABILITY,all rus company limited liability
47986,FORLIMITEDCOMPANYSECURITYNATIONALCENTRELIABILITYINFORMATION,for limited company security national centre liability information
8190,IbrahimMohammadBarzanHasanALTIKRITI,ibrahim mohammad bar zan has anal tikriti
45967,COMPANYMEDIALIABILITYGROUPLIMITED7TV,company media liability group limited 7 tv
27594,LIMITEDPETROLEUMCOMPANYALCARDINAL,limited petroleum company al cardinal
24450,LOGISTICSCOMARITIMEPRIMORYELTD,logistics co maritime primo rye ltd
30664,FLAGSTONECONCRETEMANUFACTUREANDALAMEROFFOR,flagstone concrete manufacture and a lamer of for
13414,MartinHumbertoFELIXPONCE,martin humberto felix ponce
23130,MONSALVEMARQUEZJorgeElieser,mon salve ma rquez jorge elie ser
51300,CHEKADSANATFARAZASIA,cheka d sanat far az asia
50116,ELECTRONICSCOLIMITEDHKFEPOOD,electronics co limited hk fe poo d
22223,MabkhutALARADAHKhalidAli,mab k hut a lara dah khalid ali
36367,DIGITALLIABILITYLIMITEDRUSSIANSOLUTIONSCOMPANY,digital liability limited russian solutions company
42981,COMPANYTBSLIABILITYLIMITED,company tbs liability limited
52510,MOUSAMohammedDagloHamdan,mo usa mohammed dag lo hamdan
52014,PUBLICPRODUCTIONOFCOMPANYFORMAGNEZITREFRACTORIESTHESTOCKKOMBINATJOINT,public production of company for magne zit refractories the stock kom bin at joint
33071,STOCK140PLANTJOINTCOMPANYREPAIR,stock 140 plant joint company repair
47686,SAFEDATALIABILITYCOMPANYLIMITED,safe data liability company limited
33948,RESOURCESCORPORATIONARCLTD,resources corporation arc ltd
15001,IsidroFaustoFLORESMEZA,is idr of a us to flores meza
41988,SPETSVOLTAZHLIABILITYCOMPANYLIMITED,s pets volta zh liability company limited
51457,COMPANYPARITETJOINTRDCSTOCK,company par it et joint rd c stock
43195,HENGCHENGBEIJINGXINGHUALIMITEDCOMPANYTECHNOLOGYDEVELOPMENT,heng cheng beijing xing hua limited company technology development
10849,AbogneDEVERAPio,a bog ned ever a pio
37267,PORCHASCAMACHOJesusFrancisco,porch as camacho jesus francisco
46491,MONGECAROJesusJoseGil,monge caro jesus jose gil
22483,MarwanTahHussaynALAZAWIIbrahim,mar want ahh us say nala za wi ibrahim
29526,LIMITEDSHIPPINGENERGYHONGKONGSINO,limited shipping energy hongkong sino
49527,LIABILITYCOMPANYTRANSGAZMURMANSKLIMITED,liability company trans gaz murmansk limited
49278,COMPANYLIABILITYKINGISEPSKYBUILDINGMACHINELIMITEDPLANT,company liability king is ep sky building machine limited plant
30961,MUSAalSayyidIbrahimYahya,musa al sayyid ibrahim yahya
26744,CREDITLIABILITYFINANCIALRUSSIANCOMPANYSOCIETYORGANIZATIONNONBANKLIMITED,credit liability financial russian company society organization non bank limited
43278,LIABILITYPORTCOMPANYLIMITEDSSK,liability port company limited s sk
18570,JorgeBERRIOOswaldoZAPATA,jorge ber rio oswaldo zapata
50732,MATERIELMILITARYARMAMENTOFFORTESTINGPROFITNONANDANDINSTITUTEORGANIZATIONAUTONOMOUSCERTIFICATION,mate riel military armament of for testing profit non and and institute organization autonomous certification
18751,BROKERINSURANCELIMITEDCOMPANYSBERBANKLIABILITY,broker insurance limited company s ber bank liability
48899,ELEKTRONIKEKIPMANLIMITEDGQSIRKETISOLUTION,el ek tron ike kip man limited gq sir ket i solution
46637,SIRKETITICARETVELIMITEDOTOMOTIVEGETIRSANAYI,sir ket it i caret ve limited o to motive get irs an a yi
50284,SOTVETSTVENNOSTIUNORGAURUSSLANDOGRANICHENNOIOBSHCHESTVO,so tv et st ven nos tiu nor gaur uss lando gran i chen noi ob shche st vo
7262,EASTERNISLAMICTURKISTANMOVEMENT,eastern islamic turkistan movement
46503,SERVICECARGOCENTERAO,service cargo center ao
33990,ZVECAN028RADDOO,zve can 028 rad doo
41618,CVSADEGROUPDIAMONDATLANTIC,cvs a de group diamond atlantic
26822,IMAMBANDARPETROCHEMICALFARAVARESHCOMPANY,imam bandar petrochemical far av are sh company
49824,SUPERKLICDECVSATIENDAS,super kli cde cvs at i end as
16625,VALLEAlonsoVALLELuis,valle alonso valle luis
13407,IgnacioJuanGASTELUMESPARRAGOZA,ignacio juan gastel ume s parr ago za
44461,LTDPVTSTALLIONSSOUTHERN,ltd pv t stallions southern
51399,COGNITIVEDESIGNPRODUCTIONCENTER,cognitive design production center
42084,LIABILITYLIMITEDTECHNOLOGIESCOMPANYLAND,liability limited technologies company land
44264,GMBHNAIEUROPEKGENERGYCO,gmbh nai europe kg energy co
48073,ROBLEDOMayreAdileneARREDONDO,rob le do may read ile near redondo
49347,VEIHRACATDISDENERSIRKETIITHALATANONIMTICARET,ve ihr a cat d is de ner sir ket ii thal at an on imt i caret
40318,MORINFORMSYSTEMJOINTCOMPANYCONCERNAGATSTOCK,morin form system joint company concern ag at stock
51212,AVIAAVTOMATIKAKONSTRUKTORSKOEOPITNOCOMPANYLIABILITYLIMITEDBUREAU,a via avtomat ik akon str uk tors ko e op it no company liability limited bureau
48809,NUMERICALANYANGCONTROLCOPRESSLTDFORGINGEQUIPMENT,numerical anyang control co press ltd forging equipment
47584,LIABILITYFAWARISLIMITEDCOMPANY,liability fa war is limited company
46664,BEARINGSREDNEVOLZHSKYCOMPANYLIMITEDLIABILITYPLANT,bearings red ne vol zhsky company limited liability plant
23151,LTDMARINEDAWNMANAGEMENTCO,ltd marine dawn management co
9347,CORPORATIONGENERALRYONBONGKOREA,corporation general ry on bong korea
49388,RUSOLOVOCOMPANYSTOCKJOINTPUBLIC,ru solo vo company stock joint public
41179,RLCVDERHDELITMANS,rlc v de rh del it mans
49462,SIRKETITICARETKOCGEMICILIKLIMITEDDISVETASIMACILIK,sir ket it i care tko cge mic ili k limited d is vet as imac ili k
49823,DEMULTISERVICIOSCOMBUSTIBLECVENDEVERACRUZSAMAYE,de multi ser vici os combustible cve nde veracruz sam aye
8595,AhmadMAKKIAbdullahJaffar,ahmad mak ki abdullah jaffa r
18750,SBERBANKCOMPANYLIMITEDCOMPANYLIABILITYINSURANCEINSURANCE,s ber bank company limited company liability insurance insurance
22267,HashimAydarusALHAMIDMuhsin,hashi may dar us al hamid muh s in
45739,DOROZHNYEKOMPLEKSNYEZAVODMASHINY,do ro zh nye kom p lek sny eza vo dma shiny
42456,BHDPASNASNDINTERNATIONALGROUP,b hd pas nas nd international group
48006,COMPANYLIMITEDLIABILITYINTERNATIONALHOLDINGSTEELTMK,company limited liability international holding steel tmk
11914,JuanCABALLEROVELASQUEZDaniel,juan caball ero velasquez daniel
28009,SOCIEDADANONIMAINVERSIONESZANZIBAR,sociedad an on i main version es zanzibar
47269,ESTABLISHMENTANDALGENERALTRADINGSALAMAGENCIES,establishment and al general trading salam agencies
18568,THEROCKETPEOPLESKOREANSTRATEGICOFFORCEARMY,the rocket peoples korean strategic of force army
11610,METALMINERALTRADESARL,metal mineral trades a rl
47469,SOBSHCHESTVOOTVETSTVENNOSTYUOGRANICHENNOIMETALLOOBRABOTKA,sobs h chest vo otv et st ven nost yu og rani chen noi metal loo bra bot ka
33677,PRIMECHEERLTDCORPORATION,prime cheer ltd corporation
51547,LIMITEDPETROLSAOCOMPANYTRANSPORTATIONVIET,limited petrol sao company transportation viet
50316,MAIGEOPROMLIABILITYCOMPANYLIMITED,mai geo prom liability company limited
45000,COMPANYLIMITEDLIABILITYGORNAYAKOMPANIYATAYMYRSKAYA,company limited liability gor nayak om pani yat aym yrs kaya
44661,PEIPTEENERGYLTD,pei pte energy ltd
25435,LINESGULFSHIPPINGPERSIANLTD,lines gulf shipping persian ltd
23892,TRADERMATSUNICHICAOIL,trader mats uni chica oil
18132,DalaithyWendyAMARALAREVALO,dalai thy wendy amaral are valo
47781,COMPANYLIMITEDOILSERVICESLIABILITYTMKFIELD,company limited oil services liability tmk field
49430,LIABILITYCOMPANYELGALOGISTICSLIMITED,liability company el ga logistics limited
27973,SULTANALCOMPANYMONEYTRANSFER,sultan al company money transfer
32492,FayyadAhmadIhsanALHAYES,fay yad ahmad ihs anal hayes
28538,SANOVERASARLPHARMCOMPANY,san over asar lp harm company
39489,DERECSERVISACV,de rec ser visac v
27484,RamonAntonioAVELLANMEDAL,ramon antonio a vella n medal
52179,FONDORGANIZATSIYAPROGRAMMINVESTITSIONNYKHNEKOMMERCHESKAYA,fond organ iz at si ya programm invest it sion ny kh neko mmer che s kaya
52605,TECHNOLOGIESJIANGSULTDCOMPANYENVIRONMENTALKUNYEE,technologies jiangsu ltd company environmental kun yee
47895,LIABILITYHUBCOMPANYINNOVATIONLIMITED,liability hub company innovation limited
38157,INSTITUTEJSCSUBMICRONRESEARCHSCIENTIFIC,institute jsc sub micron research scientific
29861,HOTELMANAGEMENTSYRIANLLC,hotel management syrian llc
40261,DONETSKSITUATIONSOFREPUBLICEMERGENCYOFTHEMINISTRYPEOPLES,donetsk situations of republic emergency of the ministry peoples
43519,LIMITEDPRIVATEARVANNAVYANCOMPANYABR,limited private ar van navy an company abr
47370,INCORPORATEDNSSHIPPINGLEADER,incorporated ns shipping leader
47270,TRADEINVESTMENTSABASRO,trade investments a bas ro
15521,DESARROLLOSSADECVEVEREST,de sar rollo s sade cv everest
29105,TARASTEELTRADINGGMBH,tara steel trading gmbh
45251,MENEDZHMENTLLCMOSENESSET,men ed zh ment llc mos ene s set
45043,LIMITEDTRIBITCOMPANYLIABILITY,limited tri bit company liability
51971,COMPANYPOLARLIABILITYLITHIUMLIMITED,company polar liability lithium limited
50980,HAVACILIKSAVUNMAVETICARETSANAYIANONIMSERKETIMIREX,hava c ili ksa vu nm a vet i carets an a yi an on im serket i mirex
38059,COMPANYLIABILITYLIMITEDRBESTEIT,company liability limited r best e it
49682,OULLCCNTRADING,ou llcc n trading
25961,KABIRKARANNICKELPARS,kabir karan nickel pars
37690,SCIENTIFICCOMPANYCLOSEDPRODUCTIONJOINTSTOCKTOPAZENTERPRISE,scientific company closed production joint stock topaz enterprise
47776,HELILIMITEDINTERNATIONALPROSERVICES,he li limited international pro services
26466,TRAVELSMILEPROPERTYLTD,travel smile property ltd
45553,DOOLIBERTYLAKTASIGLOBAL,doo liberty la kt as i global
32678,GRODNOFACTORYOPENTOBACCOCOMPANYNEMANJOINTSTOCK,grodno factory open tobacco company ne man joint stock
37791,COMPANYTECHNOLOGYJOINTOPENSTOCKRTPROJECT,company technology join to penstock rt project
47619,AVBISLIMITEDLIABILITYCOMPANY,a vb is limited liability company
46643,MACHINERYSINOCOLTD,machinery sino colt d
30588,RamiroGARCIAMarvinAGUILAR,ramiro garcia marvin aguilar
11880,YAGUILARAGUILARLTDACIA,y aguilar aguilar lt dacia
10118,BUSINESSLAKESGREATCOMPANY,business lakes great company
13011,DEHOSPITALARIASAMEDICACVDISTRIBUIDORA,de hospital arias a medic acv dist rib ui dora
52307,GENERALALEXCHANGEHAZMIPARTNERSHIPALCOMPANYHAZMIANDKHALEDBROTHER,general alex change h azmi partnership al company h azmi and khaled brother
7883,ZimamabdalRazzaqMuhammadALSADUN,z imam abdal razz aq muhammad als a dun
45068,COMPANYLIABILITYLIMITEDMV,company liability limited mv
37257,AngelHUERTAMORGANMiguel,angel huerta morgan miguel
13115,SADRAMARINEIRANINDUSTRIALCOMPANY,sadr a marine iran industrial company
12741,FORCESYRIANINTELLIGENCEAIR,force syrian intelligence air
37779,ENTERPRISEPRODUCTIONSTOCKCOMPANYJOINTSCIENTIFICKONTAKT,enterprise production stock company joint scientific kon tak t
51072,MARINEALYASENDIRIANBERHAD,marine aly as end irian ber had
30851,COCOMBINEIRANMANUFACTURING,co combine iran manufacturing
44211,TREIDVOSTOKAOINVEST,t reid vostok ao invest
8407,TARIQSHANABABUCOMMERCETRADEESTFOR,tariq shana babu commerce trade est for
41129,COSCLTDPTYTRADE,cos c ltd pty trade
18795,OTKRYTOENOVOVYATKAAKTSIONERNOEOBSHCHESTVO,ot k ry toe novo vy atka a kts i one rno e ob shche st vo
40817,COMPANYLIMITEDATLASESTATELIABILITYREAL,company limited atlas estate liability real
40498,LinNGBeeSerena,linn g bee serena
7286,VERGELELLTDAGANADERIA,verge le ll td aga nader i a
20904,TROCHEZJoseZULETAOscar,t roche z jose zu let a oscar
52535,COMPANYKERAMAXJOINTSTOCK,company ker a max joint stock
35885,STOCKJOINTGLOBUSBJURORYAZANSKOECOMPANYKONSTRUKTORSKOE,stock joint globus b juror yaz an sko e company kon str uk tors ko e
35349,COMPANYBYUROCORPORATIONRESEARCHANDPRODUCTIONKONSTRUKTORSKOYESTOCKJOINTMASHYNOSTROYENIYA,company by uro corporation research and production kon str uk tors k oye stock joint m ashy nos troy eni ya
52215,COMPANYITALIABILITYTECHNOLOGYLIMITED,company it a liability technology limited
49366,LIMITEDNALCOMPANYSOLUTIONS,limited nal company solutions
32496,RaymundoMARRUFOCABRERAMiguel,ray mundo marr ufo cabrera miguel
11185,SILVAJesusHenrydeRANGEL,silva jesus henry de rangel
49439,LIMITEDLIABILITYKOULSTARCOMPANY,limited liability koul star company
11543,GONZALEZEnriqueHOYOSCarlos,gonzalez enrique hoyo s carlos
51144,SYSTEMSLASERCOMPANYLIMITEDPRECISIONLIABILITY,systems laser company limited precision liability
38376,COLTDTRANSPORTATIONSTORAGEZHONGGUAND,colt d transportation storage zhong gu and
52123,KHANTOSLIABILITYLIMITEDCOMPANYGAZPROMNEFT,khan to s liability limited company gazprom ne ft
33995,METALBINEDELJKOVICPTPSINISA,metal bin ed eljko vic p tps in is a
50140,KONGTRADINGHONGLIMITEDYAYANG,kong trading hong limited ya yang
43273,CONSULTORIABLOCKCHAINLDANOVO,consul tori a block chain lda novo
25783,LINESOFSHIPPINGCHINAIRANREPUBLICISLAMIC,lines of shipping china iran republic islamic
37522,OFELECTROMECHANICSJSCAUTOMATICSINSTITUTEMOSCOWAND,of electro mechanics jsc automatics institute moscow and
51063,ELITLIABILITYCOMPANYLIMITED,elit liability company limited
51670,BANKRFJOINTCOMPANYDOMSTOCK,bank rf joint company dom stock
16651,YolChanuongMANGOKMarial,yo l chan u ong mango km arial
43099,COMPANYJOINTPOLYUSALDANSTOCK,company joint poly usa ld an stock
51161,INDIAPRIVATELIMITEDAVIATIONASCEND,india private limited aviation ascend
49433,LIMITEDLIABILITYCOMPANYELGAUGOL,limited liability company el gau gol
37803,FERRITINSTITUTESCIENTIFICDOMENANDRESEARCH,ferr it institute scientific do men and research
44982,KatarzynaEwaPAWLOWSKAHANAFIN,katarzyna ewa paw low ska hanafi n
46033,LIMITEDCOMPANYKUTUZOVSKIYQUALIFIEDDEVELOPERLIABILITY16,limited company kut uz ovsk iy qualified developer liability 16
11471,MarthaVELASQUEZMUNERAMarina,martha velasquez mun era marina
52297,MuhammadSaidABDALWADUDWail,muhammad said abd alwa dud wail
30583,PierreJosephRichardDUPLAN,pierre joseph richard dupl an
50164,SOTVETSTVENNOSTYUOBSHCHESTVODEVELOPMENTNNOGRANICHENNOI,so tv et st ven nost yu ob shche st vo development n no gran i chen noi
7618,HernandoLuisALVAREZMONTANO,hernando luis alvarez mont a no
44241,GMBHOZEANKGSPEZIALTIEFBAUHORIZONTCO,gmbh oz e an kg spezia l tie fba u horizon t co
50770,SCIENTIFICSTOCKANDAVIONICACOMPLEXPRODUCTIONUSPENSKYMOSCOWOJOINTCOMPANYOFV,scientific stock and av ionic a complex production us pen sky moscow o joint company of v
50351,LIMITEDLIABILITYCOMPANYSOLGROUP,limited liability company sol group
48735,COMPANYPRIVATEASEMANSANATSHARIFPISHRO,company private as em an sanat sharif p is hro
22752,JesusSUAREZRafaelCHOURIO,jesus suarez rafael chou rio
43083,LLEFZEPRIVATEHURIYA,lle f ze private hur iy a
17812,AlcidesMiguelVIVASLANDINO,alcides miguel vivas landi no
19890,OFSTATELIBYAANDISLAMICINIRAQASHSHAM,of state libya and islamic in iraq ash sham
47433,OAOKRASNOARMEYSKIYZAVODMEKHANICHESKIY,o a okras no arm ey ski yz a vo d me khan iche ski y
49724,VANEGASKarenHERNANDEZStefany,vane gas karen hernandez stef any
19811,FayhanAbdallahHadiALANIZISharbanalRahmanAbd,fay han abdallah had iala niz is harb anal rahman abd
9329,IbrahimYasirHasanALTIKRITISabawi,ibrahim ya sir has anal tikriti saba wi
10651,COMERCIALDECVJOANASA,co mercia l dec v joan as a
40765,MARUNSUPPLEMENTALINDUSTRIESCOMPANY,ma run supplemental industries company
28932,CVDEDERLGROUPSCHLAGERSBUSINESS,cv dede rl group sch lagers business
46644,COMPANYLIMITEDBITVANLIABILITY,company limited bit van liability
37489,FaisalYusufAbdallahSABRI,faisal yusuf abdallah s a bri
43237,OOODOMTORGOVYIPROMELECTRONIKA,ooo do mt or gov yi prom electron ika
51667,BANKNATIONALSTOCKSTANDARDCOMPANYJOINT,bank national stock standard company joint
11849,EXPRESSDELTDACARGAMODERNATRANSPORTE,express de ltd a car ga modern a transport e
36012,TICARETASBVEGRUPANONIMSIRKETIENERJISANAYI,ti careta sb ve gr up an on im sir ke tie ner j is an a yi
11484,SADEPANAMACONDORAERONAUTICA,sade panama condor aeronautica
45348,NEWBANGDEYACOTECHNOLOGYJIANGSULTDMATERIAL,new bang dey a co technology jiangsu ltd material
23667,LIMITEDGHANATRADESTAR,limited ghana trade star
44084,SCIENTIFICRUSSIANSCIENCEINSTITUTIONFEDERALCENTERKAZANACADEMYOFFEDERALOFTHECENTERSCIENCESSTATEBUDGETARYRESEARCHOF,scientific russian science institution federal center kazan academy of federal of the center sciences state budgetary research of
30884,YusufSultanHasanALARIF,yusuf sultan has anal arif
43245,COMPANYLIMITEDLIABILITYFEMILIOFIS,company limited liability fe mili of is
49405,LIMITEDCOMPANYLIABILITYKORNET,limited company liability korn et
26077,ALBOSTANISaadMeshalM,al bo stanis aad mesh alm
25698,PaulinaAnaBARAJASSAHD,paulina an aba rajas s ahd
33232,QasabiLARIRidhaAli,q as abi lari ridha ali
16847,COCHARWHITEZHONGCHUANGDALIANLTD,co char white zhong chuang dalian ltd
41258,JoelSALAZARBALLESTEROSAlexandro,joel salazar ball ester os alexandro
31531,OvidioREYESRAMIREZLeonardo,ovid i or eyes ramirez leonardo
26820,PETROCHEMICALBESPARANCOMPANYBANDARIMAM,petrochemical be s paran company bandar imam
52126,REFINERYSTOCKOMSKCOMPANYGAZPROMNEFTJOINT,refinery stock omsk company gazprom ne ft joint
46693,PROMTEKHJOINTCOMPANYSTOCKIRKUTSK,prom tek h joint company stock irkutsk
15951,ALICOMPANYSINABUPETROCHEMICAL,ali company s in abu petrochemical
589,CRYMSASAARGENTINA,cry msas a argentina
22245,TRADEGANGCOQUANSHANGHAI,trade gang co quan shanghai
23707,SHIPPINGACHIMCOKOREA,shipping ac him co korea
52206,LIABILITYAVIALYUKSSERVISCOMPANYLIMITED,liability a vial yuks se rvis company limited
47692,COMPANYLIABILITYLIMITEDMP,company liability limited mp
32731,COMPANYFRONTLIABILITYLIMITEDDUBAIWATER,company front liability limited dubai water
40573,PRIMEANDSECURITYDEVELOPMENT,prime and security development
46048,PRESSMASHLIABILITYASSOCIATIONMACHINELIMITEDCOMPANYBUILDING,press mash liability association machine limited company building
8593,RELIEFAFRICANAGENCYISLAMIC,relief african agency islamic
49817,BAGUETTECVDEKLICSACOMERCIALIZADORA,baguette cv de kli csa co mercia liza dora
42302,OFLIMITEDARTHOUSE,of limited arthouse
51526,LLCGASSERVICEANDOFENERGYOIL,llc gas service and of energy oil
11539,AbdulALVARADORahimImad,abdul alvar a dorah imi mad
40176,PRODUCTIONENTERPRISELLCPRIMARESEARCH,production enterprise llc prima research
47751,JOINTCONTAINERCOMPANYCHEMICALPLANTVERKHNYAYASALDASTOCK,joint container company chemical plant ver kh nyaya salda stock
24977,TECHNOLOGYYANBIANNETWORKCOLTDSILVERSTAR,technology yan bian network colt d silver star
7874,HassanALSADIAmirHamudi,hassan als a diamir ham udi
47574,SYSTEMSJOINTSPACECOMPANYSTOCKGAZPROM,systems joint space company stock gazprom
23133,EnriqueCUEVASQUINTEROCarlos,enrique cueva squinter o carlos
44879,BUILDINGPLANTMACHINECOMPANYTONARLIMITEDLIABILITY,building plant machine company to nar limited liability
40942,AGAKUSSWISSTEC3D,a gaku s swiss tec 3 d
21114,SAFOLKLORCANTINAYDECVRESTAURANT,s a folk lorca nti nay dec v restaurant
48823,VEDISTICARETASAYICLIMITEDSIRKETI,ved is ti careta say ic limited sir ket i
47177,FarajALHAMIDAWIMuhsinAwqad,far a jal hamida wi muh s in a wq ad
11481,LOSSANTOSAGROGANADERASA,los santos a grogan a der as a
48486,PROJECTSTOCKSEACOMPANYJOINT,project stock sea company joint
10271,JesusALVAREZFredyDELRIOde,jesus alvarez fred y del rio de
49393,LIABILITYPRAVOURMISKOECOMPANYLIMITED,liability p rav our mis ko e company limited
47342,MuhammadFadlAbdALNABI,muhammad fadl abdal nabi
50342,YAKUTIALIQUIFIEDCOMPANYLIMITEDLIABILITYNATURALGAS,ya kuti a liquified company limited liability natural gas
37797,AKTSIONERNOEPROMYSHLENNOGOINSTITUTISSLEDOVATELSKIINAUCHNORASTROBSHCHESTVOTELEVIDENIYA,a kts i one rno ep romy s hlen no go institut is sled ovate l ski in auch nor astro b shche st vote levi den iy a
46823,LIMITEDTECHNOLOGY5CO,limited technology 5 co
50969,LIABILITYLIMITEDISONORBITALRESEARCHCOMPANYDYNAMICSINSTITUTION,liability limited is on orbital research company dynamics institution
47995,LTDMAIWECOMMUNICATIONCOWUHAN,ltd mai we communication co wuhan
7324,MOROCCANGROUPCOMBATANTISLAMIC,moroccan group combatant islamic
36098,JOINTCOMPANYSTOCKSUDOEXPORT,joint company stock sudo export
7167,AMEZQUITAMariaFREGOSOAntonieta,a mezquita maria fr ego so antonie ta
35875,810REPAIRJOINTSTOCKAIRCRAFTPLANTCOMPANY,810 repair joint stock aircraft plant company
