ID,NAME,PROCESSED_NAME
25020,TADBIRGARANIRANIANINVESTMENTATIYEHCOMPANY,tad bir gar an iranian investment at i yeh company
34916,AneliSUNIGAIselMORFIN,an eli sun iga is elmo rf in
46712,LIMITEDCOSEMICONDUCTORSCI,limited co semiconductor sci
45946,KOMPLEKTCOMPANYLIABILITYLEGIONLIMITED,kom ple kt company liability legion limited
27446,PARSCOETEMADTEJARATE,pars coe tem a dte j a rate
49778,OBSHCHESTVOAKTSIONERNOEDISPLEIKOMPONENT,ob shche stv oak tsi one rno ed is plei kom pone nt
50552,ENGINEERINGCOMPANYAMADBEHINEHSAZ,engineering company a mad beh in eh s az
29112,JAHANSIRJANCOMPLEXSTEEL,jahan sir jan complex steel
49162,FANKAVCOANDISHRAYAN,f anka v co an dish ray an
45290,MOHAMEDKARTIAliAhmed,mohamed kart i ali ahmed
13405,DESERVICIOSSAVILLABONITAGASOLINERAYCV,de ser vici oss a villa bonita gasoline ray cv
29066,DIVISIONSYRIANTHEFOURTHARABARMYOF,division syrian the fourth arab army of
9553,PARTNERSHIPBANGKOKDESIGNLIMITEDARTIFLORA,partnership bangkok design limited art i flora
28060,HOLDINGSINTERNATIONALHOTELSINVESTMENTAS,holdings international hotels investment as
21904,ALOTAIBIAMohammedMubarak,a lot a ibi a mohammed mubarak
26326,VARIABLEDEANONIMALINMOCAPITALSOCIEDAD,variable dean on i mal in mo capital sociedad
45669,KamalALSHAWASharifAmer,kamal al shaw a sharif amer
50787,KONSTRUKTORSKOEBYUROLIMITEDCOMPANYLIABILITYVALKIRIYA,kon str uk tors ko e by uro limited company liability val kiri ya
11853,CIAJERGALJAIMESCSVYJEREZSCS,cia jer gal jaime s csv y jerez sc s
11616,BREYELLERCOKGGMBHTECHNOLOGYSTAHL,bre yeller co kg gmbh technology stahl
10413,CHARITABLEGOODWILLORGANIZATIONINC,charitable goodwill organization inc
25144,INTERNATIONALLAMAOFFSHORESALFOODS,international lama offshore sal foods
40378,ZAMUDIOAlfonsoLERMALuis,zam udio alfonso lerm a luis
48501,AKTSIONERNOEBYURORIOPROEKTNOOBSHCHESTVOKONSTRUKTORSKOE,a kts i one rno e by uro rio pro ek t noob shche stv ok on str uk tors ko e
15163,ENERGYINTERTRADEPETROCOMPANY,energy inter trade petro company
35893,HELICOPTERCOMPLEXROSTOVPRODUCTION,helicopter complex rostov production
44089,LIMITEDLIABILITYCENTERPETROLEUMTYUMENCOMPANYRESEARCH,limited liability center petroleum tyumen company research
41257,LuisROMANEduardoFLORES,luis roman eduardo flores
49492,PTELTDLINEPCB,pte ltd line pcb
25807,BMIICGENERALINTERNATIONALLLCTRADING,bmi ic general international llc trading
51202,BHDINDUSTRIALSDNMORALABILITY,b hd industrials dn moral ability
46510,EQUIPMENTSPARETRADINGSAANDLLCPARTSMACHINERYTHEAVY,equipment spare trading s a and llc parts machinery t heavy
49177,PROIZVODSTVENNOEOBYEDINENIENAUCHNOGORIZONT,pro iz vo dst ven no eo by ed in eni en auch no gori zon t
26566,MOVAHHEDGROUPSHAHIDDANESH,mova h he d group shahid danes h
51096,PRIVATESHARPLINELIMITEDAUTOMATION,private sharp line limited automation
18531,SALAHYunisMahirJawad,salah yun is mahi rj awad
50890,FORTHEINSTITUTESCIENCESRUSSIANACADEMYPROGRAMMINGOFOFSYSTEM,for the institute sciences russian academy programming of of system
48740,COMPANYGROUPPUBLICSTOCKASTRAJOINT,company group public stock astra joint
8596,AbdulMUHAMADABBAKARAziz,abdul mu hamada b bakar aziz
35324,LIABILITYINVESTMENTSNEMCHINOVOCOMPANYLIMITED,liability investments nem chi novo company limited
50170,OOOSEKYURITISERVISISDIDZHITAL,ooo sek yuri tis e rvis is did zhi tal
41487,KTHSROGROUPSPOL,k th s ro groups pol
18553,COMPANYINVESTMENTANDEKODEVELOPMENT,company investment and e ko development
48435,AKTSIONERNOEOBSHCHESTVOKONSTRUKTORSKOEBYUROAPPARATOSTROENIYATSENTRALNOE,a kts i one rno e ob shche stv ok on str uk tors ko e by uro appa rat ostr oen iy at sent ral no e
49537,TERSANECILIKGEMISANAYISIRKETITICARETLIMITEDBULUTLAR,ter sane c ili kg em is an a yi sir ket it i caret limited bul ut lar
9407,FINASNORTESSASANIGNACIODECVCARNESDEL,fin as nor tessa san ignacio dec v carnes del
43248,LIABILITYLIMITEDCOMPANYIKMENEDZHMENT,liability limited company ik men ed zh ment
22248,ArcadioJesusdeROSALESDELGADO,arca dio jesus de rosales delgado
51462,AKTSIONERNOEOBSHCHESTVOREGISTRATORKAPITAL,a kts i one rno e ob shche st vo regi strat or kapital
26210,RIMIINEWGROUPPROPERTIESCORPYORKOF,rim ii new group properties corp york of
49507,PLANTENTERPRISEUNITARYPRODUCTIONSVT,plant enterprise unitary production svt
31193,AbdALGHAMARIMuhammadAlKarim,abdal gh a mari muhammad al karim
48845,EVOLLIMITEDSIRKETIGROUPTRYAZILIM,e vol limited sir ket i group try a zi lim
39157,JOINTSTOCKRESEARCHANDDEVELOPMENTENTERPRISECOMPANYRADIOSVYAZ,joint stock research and development enterprise company radio sv yaz
16210,RIOSJuanitaCarmenHERNANDEZDel,rios juanita carmen hernandez del
49449,BIZNESJOINTPROYEKTCOMPANYSTOCK,biz nes joint pro ye kt company stock
52236,LIMITEDLIABILITYCOMPANYVELOKS,limited liability company velo ks
18739,LEASINGSTOCKVTBCOMPANYJOINT,leasing stock vt b company joint
40741,MOUSAHeidariMohammadSadegh,mo usa he i dari mohammad sade gh
26654,BAYINCORPORATEDSHIPPINGBALLITO,bay incorporated shipping ball i to
15140,LIMITEDSHIPPINGCOMPANYSINA,limited shipping company s in a
36057,PUBLICJOINTNEVSKOECOMPANYDESIGNBUREAUSTOCK,public joint nev sko e company design bureau stock
